,company,date,title,salary,All_Sectors,Accounting & Finance Jobs,Admin Jobs,Consultancy Jobs,HR & Recruitment Jobs,Healthcare & Nursing Jobs,IT Jobs,Legal Jobs,Logistics & Warehouse Jobs,Other/General Jobs,"PR, Advertising & Marketing Jobs",Retail Jobs,Sales Jobs,Scientific & QA Jobs,Social work Jobs,Unknown
0,Perspecta,2018-06,Cyber Systems Engineer Senior Technical Specialist,0,Unknown,0,0,0,0,0,0,0,0,0,0,0,0,0,0,1
1,Perspecta,2018-06,"National Security Open Opportunities - Annapolis Junction, MD",0,Unknown,0,0,0,0,0,0,0,0,0,0,0,0,0,0,1
2,Spectrum Healthcare Resources,2018-07,Registered Nurse,0,Unknown,0,0,0,0,0,0,0,0,0,0,0,0,0,0,1
3,Hearst Television,2018-07,Account Executive,0,"PR, Advertising & Marketing Jobs",0,0,0,0,0,0,0,0,0,1,0,0,0,0,0
4,Hearst Television,2018-07,Director Producer,0,"PR, Advertising & Marketing Jobs",0,0,0,0,0,0,0,0,0,1,0,0,0,0,0
5,2020 Companies,2018-07,NRG Retail Sales Associate - FT,0,Unknown,0,0,0,0,0,0,0,0,0,0,0,0,0,0,1
6,Care.com,2018-08,Family Looking for Preschool for Newborn,0,Social work Jobs,0,0,0,0,0,0,0,0,0,0,0,0,0,1,0
7,Spectrum Healthcare Resources,2018-09,Registered Nurse,0,Unknown,0,0,0,0,0,0,0,0,0,0,0,0,0,0,1
10,"Cardinal Health, Inc.",2018-09,"Enterprise Sales Executive, CIMS",0,Healthcare & Nursing Jobs,0,0,0,0,1,0,0,0,0,0,0,0,0,0,0
11,Baltimore Business Journal,2018-09,Advertising Sales Executive,0,Unknown,0,0,0,0,0,0,0,0,0,0,0,0,0,0,1
12,Absolute Staffers,2018-09,Registered Nurse,0,Unknown,0,0,0,0,0,0,0,0,0,0,0,0,0,0,1
13,VariQ Corporation,2018-09,Junior Staff Accountant,0,IT Jobs,0,0,0,0,0,1,0,0,0,0,0,0,0,0,0
14,Care.com,2018-09,Nanny Needed For 1 Child In Annapolis,0,Social work Jobs,0,0,0,0,0,0,0,0,0,0,0,0,0,1,0
15,"ADT Security Services, Inc.",2018-09,Commercial Security Consultant,0,Unknown,0,0,0,0,0,0,0,0,0,0,0,0,0,0,1
16,"Hayman Daugherty Associates, Inc",2018-09,Emergency Medicine Physician Job Maryland,0,Healthcare & Nursing Jobs,0,0,0,0,1,0,0,0,0,0,0,0,0,0,0
17,"Hayman Daugherty Associates, Inc",2018-09,Internal Medicine Physician Job Maryland,0,Healthcare & Nursing Jobs,0,0,0,0,1,0,0,0,0,0,0,0,0,0,0
18,SourceMD,2018-09,OBGYN opportunity- Northern VA and Maryland,0,Healthcare & Nursing Jobs,0,0,0,0,1,0,0,0,0,0,0,0,0,0,0
19,SourceMD,2018-09,Urgent Care Opportunity- Maryland/ DC/ area,0,Healthcare & Nursing Jobs,0,0,0,0,1,0,0,0,0,0,0,0,0,0,0
20,SourceMD,2018-09,Pediatric Opportunity- Maryland/ DC/ area,0,Healthcare & Nursing Jobs,0,0,0,0,1,0,0,0,0,0,0,0,0,0,0
22,"Hayman Daugherty Associates, Inc",2018-09,ObGyn Physician Job Maryland,0,Healthcare & Nursing Jobs,0,0,0,0,1,0,0,0,0,0,0,0,0,0,0
23,Wexford Health Sources,2018-09,"Excellent Physician Opportunity - Salisbury, MD",0,Healthcare & Nursing Jobs,0,0,0,0,1,0,0,0,0,0,0,0,0,0,0
27,SourceMD,2018-09,Gastroenterology opportunity- Maryland/ DC,0,Healthcare & Nursing Jobs,0,0,0,0,1,0,0,0,0,0,0,0,0,0,0
28,FCSpsy,2018-09,Adult Psychiatrist,0,Healthcare & Nursing Jobs,0,0,0,0,1,0,0,0,0,0,0,0,0,0,0
29,Patient First,2018-09,"Pediatrician for Urgent/Primary Care Practice - Greater Baltimore, MD",0,Healthcare & Nursing Jobs,0,0,0,0,1,0,0,0,0,0,0,0,0,0,0
30,TeedCo. Healthcare Recruiting,2018-09,Hospitalist-7 on/7 off,0,Healthcare & Nursing Jobs,0,0,0,0,1,0,0,0,0,0,0,0,0,0,0
31,"Teladoc Physicians, P.A.",2018-09,PsychiatristsSupplement Your Income,0,Healthcare & Nursing Jobs,0,0,0,0,1,0,0,0,0,0,0,0,0,0,0
32,"DOCTORS CHOICE PLACEMENT SERVICES, INC.",2018-09,Metro Maryland/Washington DC - GI Opportunity,0,Healthcare & Nursing Jobs,0,0,0,0,1,0,0,0,0,0,0,0,0,0,0
33,Alpha Medical Group,2018-09,Growing multispecialty group seeks entrepreneurial Gastroenterologist for exciting opportunity,0,Healthcare & Nursing Jobs,0,0,0,0,1,0,0,0,0,0,0,0,0,0,0
34,Physician Providers Mgmt. Corp.,2018-09,Hospitalist opportunity available in MD,0,Healthcare & Nursing Jobs,0,0,0,0,1,0,0,0,0,0,0,0,0,0,0
35,FCSpsy,2018-09,Psychiatric Medical Director,0,Healthcare & Nursing Jobs,0,0,0,0,1,0,0,0,0,0,0,0,0,0,0
36,Physician Providers Mgmt. Corp.,2018-09,"Gastroenterology opportunity in Baltimore, MD.",0,Healthcare & Nursing Jobs,0,0,0,0,1,0,0,0,0,0,0,0,0,0,0
37,Alliance Recruiting Resources,2018-09,Psych Full Time locum Needed near Baltimore,0,Healthcare & Nursing Jobs,0,0,0,0,1,0,0,0,0,0,0,0,0,0,0
38,Physician Providers Mgmt. Corp.,2018-09,Gastroenterology opportunity in Maryland ( Near Ocean City ),0,Healthcare & Nursing Jobs,0,0,0,0,1,0,0,0,0,0,0,0,0,0,0
39,"DOCTORS CHOICE PLACEMENT SERVICES, INC.",2018-09,Southern Maryland Opportunity,0,Healthcare & Nursing Jobs,0,0,0,0,1,0,0,0,0,0,0,0,0,0,0
40,MedSource Consultants,2018-09,Hospitalist,0,Healthcare & Nursing Jobs,0,0,0,0,1,0,0,0,0,0,0,0,0,0,0
41,Echo Locum Tenens,2018-09,HOSPITALIST NEEDED IN MARYLAND PICK UP SHIFTS AS SOON AS MID-MAY,0,Healthcare & Nursing Jobs,0,0,0,0,1,0,0,0,0,0,0,0,0,0,0
42,Integrity Healthcare,2018-09,OB/GYN needed in Maryland,0,Healthcare & Nursing Jobs,0,0,0,0,1,0,0,0,0,0,0,0,0,0,0
43,"DOCTORS CHOICE PLACEMENT SERVICES, INC.",2018-09,New Outpatient Primary Care Opportunities in Maryland - Next to DC & Baltimore,0,Healthcare & Nursing Jobs,0,0,0,0,1,0,0,0,0,0,0,0,0,0,0
44,Enterprise Medical Recruiting,2018-09,"FM/IM need 20 minutes from Washington, D.C.",0,Healthcare & Nursing Jobs,0,0,0,0,1,0,0,0,0,0,0,0,0,0,0
45,Enterprise Medical Recruiting,2018-09,Outpatient Psychiatry in Western Maryland - H1b and J1 Sponsorship Available,0,Healthcare & Nursing Jobs,0,0,0,0,1,0,0,0,0,0,0,0,0,0,0
46,Integrity Healthcare,2018-09,Emergency Medicine Physician Opportunity- Western Maryland,0,Healthcare & Nursing Jobs,0,0,0,0,1,0,0,0,0,0,0,0,0,0,0
47,"Hayman Daugherty Associates, Inc",2018-09,Gastroenterology Physician Job Maryland,0,Healthcare & Nursing Jobs,0,0,0,0,1,0,0,0,0,0,0,0,0,0,0
51,TeedCo. Healthcare Recruiting,2018-09,"D.C. Area: Major Academic Affiliation, Low Annual Hours. EM physician need for expansion",0,Healthcare & Nursing Jobs,0,0,0,0,1,0,0,0,0,0,0,0,0,0,0
52,Enterprise Medical Recruiting,2018-09,Attending Physician Emergency Medicine 15 miles N/E of DC in Maryland,0,Healthcare & Nursing Jobs,0,0,0,0,1,0,0,0,0,0,0,0,0,0,0
53,"Hayman Daugherty Associates, Inc",2018-09,Urgent Care Physician Job Maryland,0,Healthcare & Nursing Jobs,0,0,0,0,1,0,0,0,0,0,0,0,0,0,0
54,Enterprise Medical Recruiting,2018-09,"Outpatient FM/IM need in Towson, MD",0,Healthcare & Nursing Jobs,0,0,0,0,1,0,0,0,0,0,0,0,0,0,0
55,National Health Partners,2018-09,Hospital Employed Gastroenterologist Needed ,0,Healthcare & Nursing Jobs,0,0,0,0,1,0,0,0,0,0,0,0,0,0,0
56,"Consilium Staffing, LLC",2018-09,"Hiring Physician ASAP, Gastroenterology—Maryland",0,Healthcare & Nursing Jobs,0,0,0,0,1,0,0,0,0,0,0,0,0,0,0
58,Ascend Medical Staffing,2018-09,Bethesda MD Tele-Psychiatry - any state license,0,Healthcare & Nursing Jobs,0,0,0,0,1,0,0,0,0,0,0,0,0,0,0
59,VeloSource,2018-09,"Democratic group seeks Emergency medicine physician for job opportunity in Maryland, $65K sign on",0,Healthcare & Nursing Jobs,0,0,0,0,1,0,0,0,0,0,0,0,0,0,0
60,Physician Providers Mgmt. Corp.,2018-09,"Hospitalist wanted in Charles Co., MD.",0,Healthcare & Nursing Jobs,0,0,0,0,1,0,0,0,0,0,0,0,0,0,0
61,"Hayman Daugherty Associates, Inc",2018-09,Hospitalist Physician Job Maryland,0,Healthcare & Nursing Jobs,0,0,0,0,1,0,0,0,0,0,0,0,0,0,0
62,Integrity Healthcare,2018-09,NocturnistMaryland/DC area,0,Healthcare & Nursing Jobs,0,0,0,0,1,0,0,0,0,0,0,0,0,0,0
63,"MD Staff Pointe, LLC",2018-09,Hospitalist Locums Maryland / DC,0,Healthcare & Nursing Jobs,0,0,0,0,1,0,0,0,0,0,0,0,0,0,0
64,Continuum Medical Staffing,2018-09,Pediatrician Baltimore Suburbs MD,0,Healthcare & Nursing Jobs,0,0,0,0,1,0,0,0,0,0,0,0,0,0,0
69,Wexford Health Sources,2018-09,"$25k Signing BonusRegional Medical Director in Cumberland, MD",0,Healthcare & Nursing Jobs,0,0,0,0,1,0,0,0,0,0,0,0,0,0,0
70,Enterprise Medical Recruiting,2018-09,Northwestern Maryland Group Adding Ob/Gyn Physician,0,Healthcare & Nursing Jobs,0,0,0,0,1,0,0,0,0,0,0,0,0,0,0
71,Samuel Contract Staffing,2018-09,We're looking for a MD or DO in Virginia/Washington DC,0,Healthcare & Nursing Jobs,0,0,0,0,1,0,0,0,0,0,0,0,0,0,0
72,Echo Locum Tenens,2018-09,Maryland Inpatient Hospitalists needed near D.C.,0,Healthcare & Nursing Jobs,0,0,0,0,1,0,0,0,0,0,0,0,0,0,0
73,Enterprise Medical Recruiting,2018-09,Outpatient only Neurology position in water front Maryland,0,Healthcare & Nursing Jobs,0,0,0,0,1,0,0,0,0,0,0,0,0,0,0
75,Enterprise Medical Recruiting,2018-09,"80K Sign-on Emergency Medicine Physician 30 Miles South of Alexandria, VA",0,Healthcare & Nursing Jobs,0,0,0,0,1,0,0,0,0,0,0,0,0,0,0
76,RCM Health Care Services,2018-09,"URGENT CARE LOCUM PHYSICIANS NEEDED IN PA, WV, MA, AR, MD & MN",0,Healthcare & Nursing Jobs,0,0,0,0,1,0,0,0,0,0,0,0,0,0,0
77,Continuum Medical Staffing,2018-09,Hospitalist Southern Maryland,0,Healthcare & Nursing Jobs,0,0,0,0,1,0,0,0,0,0,0,0,0,0,0
78,TeedCo. Healthcare Recruiting,2018-09,Beautiful Western Maryland location,0,Healthcare & Nursing Jobs,0,0,0,0,1,0,0,0,0,0,0,0,0,0,0
79,SourceMD,2018-09,IM Opportunity- Maryland- near DC,0,Healthcare & Nursing Jobs,0,0,0,0,1,0,0,0,0,0,0,0,0,0,0
80,Continuum Medical Staffing,2018-09,Internal Medicine Baltimore MD,0,Healthcare & Nursing Jobs,0,0,0,0,1,0,0,0,0,0,0,0,0,0,0
81,TeedCo. Healthcare Recruiting,2018-09,"Washington DC area, Work Less, Earn More, Play More",0,Healthcare & Nursing Jobs,0,0,0,0,1,0,0,0,0,0,0,0,0,0,0
82,"Hayman Daugherty Associates, Inc",2018-09,Emergency Medicine in Maryland,0,Healthcare & Nursing Jobs,0,0,0,0,1,0,0,0,0,0,0,0,0,0,0
83,Continuum Medical Staffing,2018-09,Neurology Fredrick MD,0,Healthcare & Nursing Jobs,0,0,0,0,1,0,0,0,0,0,0,0,0,0,0
84,Echo Locum Tenens,2018-09,Inpatient hospitalist - MD,0,Healthcare & Nursing Jobs,0,0,0,0,1,0,0,0,0,0,0,0,0,0,0
86,KPS Physician Staffing,2018-09,Family Practice/EM Physician Needed for Fast Track/Urgent Care Near the Beltway,0,Healthcare & Nursing Jobs,0,0,0,0,1,0,0,0,0,0,0,0,0,0,0
87,Enterprise Medical Recruiting,2018-09,"FM/IM Need in Silver Spring, MD",0,Healthcare & Nursing Jobs,0,0,0,0,1,0,0,0,0,0,0,0,0,0,0
88,Alpha Medical Group,2018-09,Growing multi-specialty group seeks OB/GYN physicians for two office locations in prime Washington DC suburbs.,0,Healthcare & Nursing Jobs,0,0,0,0,1,0,0,0,0,0,0,0,0,0,0
89,Enterprise Medical Recruiting,2018-09,Outpatient Internal Medicine Position,0,Healthcare & Nursing Jobs,0,0,0,0,1,0,0,0,0,0,0,0,0,0,0
90,Echo Locum Tenens,2018-09,FAMILY PRACTICE HOSPITALISTS NEEDED IN MARYLAND,0,Healthcare & Nursing Jobs,0,0,0,0,1,0,0,0,0,0,0,0,0,0,0
91,Alpha Medical Group,2018-09,Minimally Invasive Gynecological Surgery opportunity.,0,Healthcare & Nursing Jobs,0,0,0,0,1,0,0,0,0,0,0,0,0,0,0
92,Enterprise Medical Recruiting,2018-09,"FM/IM need in District Heights, MD",0,Healthcare & Nursing Jobs,0,0,0,0,1,0,0,0,0,0,0,0,0,0,0
93,Physician Services,2018-09,Hospitalist Baltimore MD,0,Healthcare & Nursing Jobs,0,0,0,0,1,0,0,0,0,0,0,0,0,0,0
94,"Teladoc Physicians, P.A.",2018-09,Supplement Your Income - TELEMEDICINE,0,Healthcare & Nursing Jobs,0,0,0,0,1,0,0,0,0,0,0,0,0,0,0
96,US Army 1st Medical Recruiting Battalion,2018-09,Family Practice,0,Healthcare & Nursing Jobs,0,0,0,0,1,0,0,0,0,0,0,0,0,0,0
98,"DOCTORS CHOICE PLACEMENT SERVICES, INC.",2018-09,New GI Hospitalist Opportunity in Maryland - Next to DC & Baltimore,0,Healthcare & Nursing Jobs,0,0,0,0,1,0,0,0,0,0,0,0,0,0,0
99,"Hayman Daugherty Associates, Inc",2018-09,DC OBGYN with partnership track,0,Healthcare & Nursing Jobs,0,0,0,0,1,0,0,0,0,0,0,0,0,0,0
100,Physician Providers Mgmt. Corp.,2018-09,Psychiatry position available in Maryland,0,Healthcare & Nursing Jobs,0,0,0,0,1,0,0,0,0,0,0,0,0,0,0
101,MedSource Consultants,2018-09,Adult Psychiatrist,0,Healthcare & Nursing Jobs,0,0,0,0,1,0,0,0,0,0,0,0,0,0,0
102,"Consilium Staffing, LLC",2018-09,Hiring Locum Tenens Cardiac Anesthesiologist ASAP—Maryland,0,Healthcare & Nursing Jobs,0,0,0,0,1,0,0,0,0,0,0,0,0,0,0
103,Echo Locum Tenens,2018-09,Hospitalist Moonlighting/Locum Opportunity in Maryland QUICK CREDENTIALING,0,Healthcare & Nursing Jobs,0,0,0,0,1,0,0,0,0,0,0,0,0,0,0
104,Echo Locum Tenens,2018-09,NEW SEEKING INTERNAL MEDICINE HOSPITALIST FOR MARYLAND QUICK CREDENTIALING,0,Healthcare & Nursing Jobs,0,0,0,0,1,0,0,0,0,0,0,0,0,0,0
105,Goldfish Medical Staffing,2018-09,"Psychiatry Opportunity Near Washington, DC (9115 LM)",0,Healthcare & Nursing Jobs,0,0,0,0,1,0,0,0,0,0,0,0,0,0,0
106,Elevate Healthcare Consultants,2018-09,"Psychiatry, Psychiatrist, Medical Director, Staff, Employed, Adult, Maryland",0,Healthcare & Nursing Jobs,0,0,0,0,1,0,0,0,0,0,0,0,0,0,0
107,"DOCTORS CHOICE PLACEMENT SERVICES, INC.",2018-09,WESTERN MARYLAND LOCATION - CRNA OPPORTUNITY,0,Healthcare & Nursing Jobs,0,0,0,0,1,0,0,0,0,0,0,0,0,0,0
108,Integrity Healthcare,2018-09,Psychiatrist Position in Western Maryland,0,Healthcare & Nursing Jobs,0,0,0,0,1,0,0,0,0,0,0,0,0,0,0
109,"Hayman Daugherty Associates, Inc",2018-09,Gastroenterologist Opening in Metro Baltimore-Washington Area,0,Healthcare & Nursing Jobs,0,0,0,0,1,0,0,0,0,0,0,0,0,0,0
110,Continuum Medical Staffing,2018-09,Hospitalist Southern MD,0,Healthcare & Nursing Jobs,0,0,0,0,1,0,0,0,0,0,0,0,0,0,0
111,"Priority Physicians, Inc.",2018-09,100% Outpatient on the Eastern Shore,0,Healthcare & Nursing Jobs,0,0,0,0,1,0,0,0,0,0,0,0,0,0,0
112,Continuum Medical Staffing,2018-09,Gastroenterologist,0,Healthcare & Nursing Jobs,0,0,0,0,1,0,0,0,0,0,0,0,0,0,0
113,"DOCTORS CHOICE PLACEMENT SERVICES, INC.",2018-09,Post Acute Care Physician Needed in Southern Maryland - Near the Chesapeake Bay,0,Healthcare & Nursing Jobs,0,0,0,0,1,0,0,0,0,0,0,0,0,0,0
114,Source Medical,2018-09,GI with Inflammatory Bowel Disease or ERCP/EUS Preferred,0,Healthcare & Nursing Jobs,0,0,0,0,1,0,0,0,0,0,0,0,0,0,0
115,Alpha Medical Group,2018-09,Employed Gastroenterology position.,0,Healthcare & Nursing Jobs,0,0,0,0,1,0,0,0,0,0,0,0,0,0,0
116,MedSource Consultants,2018-09,Adult/Addiction Psychiatrist,0,Healthcare & Nursing Jobs,0,0,0,0,1,0,0,0,0,0,0,0,0,0,0
117,US Army 1st Medical Recruiting Battalion,2018-09,Army Reserve Obstetrician/Gynecologist,0,Healthcare & Nursing Jobs,0,0,0,0,1,0,0,0,0,0,0,0,0,0,0
118,Enterprise Medical Recruiting,2018-09,"Internal Medicine need in Silver Spring, MD",0,Healthcare & Nursing Jobs,0,0,0,0,1,0,0,0,0,0,0,0,0,0,0
119,Source Medical,2018-09,Neurology opportunity near DC,0,Healthcare & Nursing Jobs,0,0,0,0,1,0,0,0,0,0,0,0,0,0,0
120,All Star Recruiting,2018-09,"Great Practice for a Pediatrician in Maryland, Mainly Outpatient",0,Healthcare & Nursing Jobs,0,0,0,0,1,0,0,0,0,0,0,0,0,0,0
121,TeedCo. Healthcare Recruiting,2018-09,Pediatric Hospitalist,0,Healthcare & Nursing Jobs,0,0,0,0,1,0,0,0,0,0,0,0,0,0,0
123,Alpha Medical Group,2018-09,Hospital employed outpatient practice.,0,Healthcare & Nursing Jobs,0,0,0,0,1,0,0,0,0,0,0,0,0,0,0
124,TeedCo. Healthcare Recruiting,2018-09,"DC AREA, High Acuity, Major Academic Affiliation, Low Annual Hours",0,Healthcare & Nursing Jobs,0,0,0,0,1,0,0,0,0,0,0,0,0,0,0
125,Weatherby Healthcare,2018-09,Emergency Medicine in MD - Locums: Maryland Medical Facility Seeks Locums Emergency Medicine Physician,0,Healthcare & Nursing Jobs,0,0,0,0,1,0,0,0,0,0,0,0,0,0,0
126,Integrity Healthcare,2018-09,Neurologist needed in Maryland,0,Healthcare & Nursing Jobs,0,0,0,0,1,0,0,0,0,0,0,0,0,0,0
127,Integrity Healthcare,2018-09,Traditional Internal Medicine Opening in Maryland,0,Healthcare & Nursing Jobs,0,0,0,0,1,0,0,0,0,0,0,0,0,0,0
128,Enterprise Medical Recruiting,2018-09,"Outpatient primary care need in Silver Spring, MD",0,Healthcare & Nursing Jobs,0,0,0,0,1,0,0,0,0,0,0,0,0,0,0
129,"DOCTORS CHOICE PLACEMENT SERVICES, INC.",2018-09,Multiple Maryland Opportunities,0,Healthcare & Nursing Jobs,0,0,0,0,1,0,0,0,0,0,0,0,0,0,0
130,Continuum Medical Staffing,2018-09,OB GYN Silver Spring MD,0,Healthcare & Nursing Jobs,0,0,0,0,1,0,0,0,0,0,0,0,0,0,0
131,Source Medical,2018-09,(Eastern Shore of MD) Adult Psych / Outpatient Only/ Visas OK,0,Healthcare & Nursing Jobs,0,0,0,0,1,0,0,0,0,0,0,0,0,0,0
132,Enterprise Medical Recruiting,2018-09,Emergency Medicine Physician Near Baltimore,0,Healthcare & Nursing Jobs,0,0,0,0,1,0,0,0,0,0,0,0,0,0,0
133,Physician Providers Mgmt. Corp.,2018-09,OBGYN wanted North of DC Metro/Maryland Suburbs,0,Healthcare & Nursing Jobs,0,0,0,0,1,0,0,0,0,0,0,0,0,0,0
134,Enterprise Medical Recruiting,2018-09,"Urgent Care Physician, Locations between Baltimore/Wash DC",0,Healthcare & Nursing Jobs,0,0,0,0,1,0,0,0,0,0,0,0,0,0,0
135,Continuum Medical Staffing,2018-09,Hospitalist Maryland Suburban DC,0,Healthcare & Nursing Jobs,0,0,0,0,1,0,0,0,0,0,0,0,0,0,0
136,"Priority Physicians, Inc.",2018-09,Quality OBGYN Practice on the Potomac River,0,Healthcare & Nursing Jobs,0,0,0,0,1,0,0,0,0,0,0,0,0,0,0
137,"Consilium Staffing, LLC",2018-09,Maryland Full Time Inpatient Psychiatrist,0,Healthcare & Nursing Jobs,0,0,0,0,1,0,0,0,0,0,0,0,0,0,0
138,Echo Locum Tenens,2018-09,Moonlighters needed in MD,0,Healthcare & Nursing Jobs,0,0,0,0,1,0,0,0,0,0,0,0,0,0,0
139,NHR,2018-09,DC/Baltimore Area Emergency Medicine need,0,Healthcare & Nursing Jobs,0,0,0,0,1,0,0,0,0,0,0,0,0,0,0
140,VeloSource,2018-09,Permanent Emergency Medicine Opportunity in Maryland-New Grads Accepted,0,Healthcare & Nursing Jobs,0,0,0,0,1,0,0,0,0,0,0,0,0,0,0
141,BAS Healthcare,2018-09,Top Paying Psych in Baltimore,0,Healthcare & Nursing Jobs,0,0,0,0,1,0,0,0,0,0,0,0,0,0,0
142,VeloSource,2018-09,"Democratic group seeks Emergency Medicine Physician for opportunity in Maryland, $65K sign on",0,Healthcare & Nursing Jobs,0,0,0,0,1,0,0,0,0,0,0,0,0,0,0
143,"Hayman Daugherty Associates, Inc",2018-09,OBGYN needed in DC,0,Healthcare & Nursing Jobs,0,0,0,0,1,0,0,0,0,0,0,0,0,0,0
144,Continuum Medical Staffing,2018-09,Urology Leonardtown MD,0,Healthcare & Nursing Jobs,0,0,0,0,1,0,0,0,0,0,0,0,0,0,0
146,Continuum Medical Staffing,2018-09,Urologist Southern Maryland,0,Healthcare & Nursing Jobs,0,0,0,0,1,0,0,0,0,0,0,0,0,0,0
147,"DOCTORS CHOICE PLACEMENT SERVICES, INC.",2018-09,New GI Opportunities (2) in Maryland - Next to DC & Baltimore,0,Healthcare & Nursing Jobs,0,0,0,0,1,0,0,0,0,0,0,0,0,0,0
148,Goldfish Medical Staffing,2018-09,"GI Hospitalist Opportunity in the Washington, D.C. Metropolitan Area (9559 LM)",0,Healthcare & Nursing Jobs,0,0,0,0,1,0,0,0,0,0,0,0,0,0,0
149,Continuum Medical Staffing,2018-09,OB/ GYN Eldersburg Maryland,0,Healthcare & Nursing Jobs,0,0,0,0,1,0,0,0,0,0,0,0,0,0,0
150,Physician Providers Mgmt. Corp.,2018-09,"Urologist wanted in Charles Co., MD.",0,Healthcare & Nursing Jobs,0,0,0,0,1,0,0,0,0,0,0,0,0,0,0
153,All Star Recruiting,2018-09,OBGYN Opening less than an Hour and a Half from DC in Maryland Suburb,0,Healthcare & Nursing Jobs,0,0,0,0,1,0,0,0,0,0,0,0,0,0,0
154,Medicus Healthcare Solutions,2018-09,Full-Time Hospitalist Opportunity in Maryland,0,Healthcare & Nursing Jobs,0,0,0,0,1,0,0,0,0,0,0,0,0,0,0
155,"MD Staff Pointe, LLC",2018-09,Hospitalist Locums Baltimore / DC,0,Healthcare & Nursing Jobs,0,0,0,0,1,0,0,0,0,0,0,0,0,0,0
156,BAS Healthcare,2018-09,Maryland Inpatient Psychiatry Opening,0,Healthcare & Nursing Jobs,0,0,0,0,1,0,0,0,0,0,0,0,0,0,0
157,Enterprise Medical Recruiting,2018-09,Employed Gastroenterology position in Berlin MD,0,Healthcare & Nursing Jobs,0,0,0,0,1,0,0,0,0,0,0,0,0,0,0
158,Integrity Healthcare,2018-09,Anesthesiologist - Western Maryland,0,Healthcare & Nursing Jobs,0,0,0,0,1,0,0,0,0,0,0,0,0,0,0
159,Continuum Medical Staffing,2018-09,Neurology Northern Baltimore Suburbs,0,Healthcare & Nursing Jobs,0,0,0,0,1,0,0,0,0,0,0,0,0,0,0
160,Alpha Medical Group,2018-09,Urologist with training in Female Urology needed to join a large private practice on a partnership track.,0,Healthcare & Nursing Jobs,0,0,0,0,1,0,0,0,0,0,0,0,0,0,0
162,"Born & Bicknell, Inc.",2018-09,Outpatient Internal Medicine physician needed in MD will consider H1B Visas,0,Healthcare & Nursing Jobs,0,0,0,0,1,0,0,0,0,0,0,0,0,0,0
163,Enterprise Medical Recruiting,2018-09,"Emergency Medicine Physician Near Gaithersburg, MD",0,Healthcare & Nursing Jobs,0,0,0,0,1,0,0,0,0,0,0,0,0,0,0
164,Continuum Medical Staffing,2018-09,Internal Medicine Waldorf MD,0,Healthcare & Nursing Jobs,0,0,0,0,1,0,0,0,0,0,0,0,0,0,0
165,All Star Recruiting,2018-09,Full-time Gastroenterology opportunity available about an hour from Washington DC,0,Healthcare & Nursing Jobs,0,0,0,0,1,0,0,0,0,0,0,0,0,0,0
167,Samuel Contract Staffing,2018-09,Physician for Maryland,0,Healthcare & Nursing Jobs,0,0,0,0,1,0,0,0,0,0,0,0,0,0,0
168,BAS Healthcare,2018-09,Annapolis Maryland has Adult Psychiatry opening,0,Healthcare & Nursing Jobs,0,0,0,0,1,0,0,0,0,0,0,0,0,0,0
169,BAS Healthcare,2018-09,Suburbs of Baltimore Top Opening,0,Healthcare & Nursing Jobs,0,0,0,0,1,0,0,0,0,0,0,0,0,0,0
170,BAS Healthcare,2018-09,Nocturnist Block Scheduled in Affluent Suburb of DC,0,Healthcare & Nursing Jobs,0,0,0,0,1,0,0,0,0,0,0,0,0,0,0
171,Alpha Medical Group,2018-09,Private practice in the Mid-Atlantic Region is looking for two OB/GYN physicians to join them.,0,Healthcare & Nursing Jobs,0,0,0,0,1,0,0,0,0,0,0,0,0,0,0
172,BAS Healthcare,2018-09,Join the most successful practice in the area,0,Healthcare & Nursing Jobs,0,0,0,0,1,0,0,0,0,0,0,0,0,0,0
173,Enterprise Medical Recruiting,2018-09,Attending Physician Emergency Medicine 1 Hour S/E of DC in Maryland,0,Healthcare & Nursing Jobs,0,0,0,0,1,0,0,0,0,0,0,0,0,0,0
174,Enterprise Medical Recruiting,2018-09,Attending Physician Emergency Medicine One hour North of Baltimore,0,Healthcare & Nursing Jobs,0,0,0,0,1,0,0,0,0,0,0,0,0,0,0
175,BAS Healthcare,2018-09,Medical Director Role - Top Compensation Minutes from Baltimore,0,Healthcare & Nursing Jobs,0,0,0,0,1,0,0,0,0,0,0,0,0,0,0
176,Britt Medical Search,2018-09,Established Pediatric Practice Minutes Outside Washington DC seeks a Fifth Pediatrician,0,Healthcare & Nursing Jobs,0,0,0,0,1,0,0,0,0,0,0,0,0,0,0
178,All Star Recruiting,2018-09,Pain Management need in the metro Washington D.C. area - No Call or Weekends,0,Healthcare & Nursing Jobs,0,0,0,0,1,0,0,0,0,0,0,0,0,0,0
179,"MedCare Staffing, Inc.",2018-09,Primary Care/IM/FP VA need,0,Healthcare & Nursing Jobs,0,0,0,0,1,0,0,0,0,0,0,0,0,0,0
180,Echo Locum Tenens,2018-09,"Amazing Locum Opportunity in Boston, MA area",0,Healthcare & Nursing Jobs,0,0,0,0,1,0,0,0,0,0,0,0,0,0,0
181,ESR Healthcare Recruitment,2018-09,2 OB/GYN physicians Holly Oaks Maryland sj,0,Healthcare & Nursing Jobs,0,0,0,0,1,0,0,0,0,0,0,0,0,0,0
182,Physician Providers Mgmt. Corp.,2018-09,Wanted: Pediatrician seeking Outpatient in Maryland.,0,Healthcare & Nursing Jobs,0,0,0,0,1,0,0,0,0,0,0,0,0,0,0
183,"DOCTORS CHOICE PLACEMENT SERVICES, INC.",2018-09,Maryland/DC area OB/GYN Opportunity,0,Healthcare & Nursing Jobs,0,0,0,0,1,0,0,0,0,0,0,0,0,0,0
184,"Born & Bicknell, Inc.",2018-09,Psychiatry Physician Job in Western Maryland. Can sponsor J1Visa,0,Healthcare & Nursing Jobs,0,0,0,0,1,0,0,0,0,0,0,0,0,0,0
185,Alpha Medical Group,2018-09,Two Urology opportunities - General Urologist and a fellowship trained Robotics Urologist.,0,Healthcare & Nursing Jobs,0,0,0,0,1,0,0,0,0,0,0,0,0,0,0
186,"AB Staffing Solutions, LLC",2018-09,Primary Care Physician,0,Healthcare & Nursing Jobs,0,0,0,0,1,0,0,0,0,0,0,0,0,0,0
187,Quest Healthcare Solutions,2018-09,Hospitalist - Locum Tenens Job in Maryland,0,Healthcare & Nursing Jobs,0,0,0,0,1,0,0,0,0,0,0,0,0,0,0
188,Weatherby Healthcare,2018-09,Gastroenterology in MD - Locums: Maryland Facility in Search of a Locum Tenens Gastroenterologist,0,Healthcare & Nursing Jobs,0,0,0,0,1,0,0,0,0,0,0,0,0,0,0
189,Enterprise Medical Recruiting,2018-09,"Annapolis, MD Area Outpatient Primary Care Position",0,Healthcare & Nursing Jobs,0,0,0,0,1,0,0,0,0,0,0,0,0,0,0
190,"DOCTORS CHOICE PLACEMENT SERVICES, INC.",2018-09,Maryland OB/GYN Opportunity,0,Healthcare & Nursing Jobs,0,0,0,0,1,0,0,0,0,0,0,0,0,0,0
191,Enterprise Medical Recruiting,2018-09,Group GI position in Annapolis/Baltimore,0,Healthcare & Nursing Jobs,0,0,0,0,1,0,0,0,0,0,0,0,0,0,0
192,MedSource Consultants,2018-09,Gastroenterologist,0,Healthcare & Nursing Jobs,0,0,0,0,1,0,0,0,0,0,0,0,0,0,0
193,Continuum Medical Staffing,2018-09,Internal Medicine (OP) Northern Baltimore Suburbs,0,Healthcare & Nursing Jobs,0,0,0,0,1,0,0,0,0,0,0,0,0,0,0
194,Alpha Medical Group,2018-09,General Urologist needed to join a large private practice.,0,Healthcare & Nursing Jobs,0,0,0,0,1,0,0,0,0,0,0,0,0,0,0
195,US Army 1st Medical Recruiting Battalion,2018-09,Army Reserve Anesthesiologist,0,Healthcare & Nursing Jobs,0,0,0,0,1,0,0,0,0,0,0,0,0,0,0
196,Continuum Medical Staffing,2018-09,UROLOGIST SOUTHERN MARYLAND,0,Healthcare & Nursing Jobs,0,0,0,0,1,0,0,0,0,0,0,0,0,0,0
197,"DOCTORS CHOICE PLACEMENT SERVICES, INC.",2018-09,New Outpatient Primary Care Opportunities in Maryland - Next to DC,0,Healthcare & Nursing Jobs,0,0,0,0,1,0,0,0,0,0,0,0,0,0,0
198,"Med Career Center, Inc",2018-09,Advanced skilled GI needed in metro MD,0,Healthcare & Nursing Jobs,0,0,0,0,1,0,0,0,0,0,0,0,0,0,0
200,Enterprise Medical Recruiting,2018-09,Outpatient Primary Care position West of Baltimore,0,Healthcare & Nursing Jobs,0,0,0,0,1,0,0,0,0,0,0,0,0,0,0
202,MedSource Consultants,2018-09,IM Physician,0,Healthcare & Nursing Jobs,0,0,0,0,1,0,0,0,0,0,0,0,0,0,0
203,"DOCTORS CHOICE PLACEMENT SERVICES, INC.",2018-09,"Psychiatry/Addiction Medicine Opportunities in Northern Virginia, DC & Maryland",0,Healthcare & Nursing Jobs,0,0,0,0,1,0,0,0,0,0,0,0,0,0,0
204,Source Medical,2018-09,DC Metro / Hospitalist / 10-hour Shifts,0,Healthcare & Nursing Jobs,0,0,0,0,1,0,0,0,0,0,0,0,0,0,0
205,US Army 1st Medical Recruiting Battalion,2018-09,Army Reserve Emergency Medicine Physician,0,Healthcare & Nursing Jobs,0,0,0,0,1,0,0,0,0,0,0,0,0,0,0
207,Source Medical,2018-09,Urologist needed to join the largest Urology group in the Mid Atlantic region,0,Healthcare & Nursing Jobs,0,0,0,0,1,0,0,0,0,0,0,0,0,0,0
208,Alpha Medical Group,2018-09,Hospital employed outpatient positions in desirable suburb of Baltimore.,0,Healthcare & Nursing Jobs,0,0,0,0,1,0,0,0,0,0,0,0,0,0,0
