,company,date,title,salary,All_Sectors,Accounting & Finance Jobs,Admin Jobs,Consultancy Jobs,HR & Recruitment Jobs,Healthcare & Nursing Jobs,IT Jobs,Legal Jobs,Logistics & Warehouse Jobs,Other/General Jobs,"PR, Advertising & Marketing Jobs",Retail Jobs,Sales Jobs,Scientific & QA Jobs,Social work Jobs,Unknown
209,Enterprise Medical Recruiting,2018-09,Annapolis Gastroenterology position - Partnership Track,0,Healthcare & Nursing Jobs,0,0,0,0,1,0,0,0,0,0,0,0,0,0,0
210,Continuum Medical Staffing,2018-09,Emergency Medicine Physician Columbia Maryland,0,Healthcare & Nursing Jobs,0,0,0,0,1,0,0,0,0,0,0,0,0,0,0
211,Enterprise Medical Recruiting,2018-09,"Silver Spring, MD Internal Medicine Position",0,Healthcare & Nursing Jobs,0,0,0,0,1,0,0,0,0,0,0,0,0,0,0
212,Quest Healthcare Solutions,2018-09,Anesthesiology | Locum Tenens Need in Maryland,0,Healthcare & Nursing Jobs,0,0,0,0,1,0,0,0,0,0,0,0,0,0,0
213,Source Medical,2018-09,DC Metro Area - GI to Join Premier Practice (General or Interventional),0,Healthcare & Nursing Jobs,0,0,0,0,1,0,0,0,0,0,0,0,0,0,0
214,Source Medical,2018-09,7 on 7 off/ no weekends Neuro Hospitalist Opening,0,Healthcare & Nursing Jobs,0,0,0,0,1,0,0,0,0,0,0,0,0,0,0
215,Quest Healthcare Solutions,2018-09,Hospitalist| Locum Tenens Needed in Maryland,0,Healthcare & Nursing Jobs,0,0,0,0,1,0,0,0,0,0,0,0,0,0,0
216,US Army 1st Medical Recruiting Battalion,2018-09,Army Reserve Psychiatrist,0,Healthcare & Nursing Jobs,0,0,0,0,1,0,0,0,0,0,0,0,0,0,0
217,Enterprise Medical Recruiting,2018-09,Baltimore Outpatient Psychiatry with No Call - Student Loan Repayment,0,Healthcare & Nursing Jobs,0,0,0,0,1,0,0,0,0,0,0,0,0,0,0
218,SmartDocs Direct,2018-09,Psychiatry Locums,0,Healthcare & Nursing Jobs,0,0,0,0,1,0,0,0,0,0,0,0,0,0,0
219,Enterprise Medical Recruiting,2018-09,"Practice Psychiatry near Baltimore, Maryland - Employed Position",0,Healthcare & Nursing Jobs,0,0,0,0,1,0,0,0,0,0,0,0,0,0,0
220,The Medicus Firm,2018-09,Neurology $200K with Sign on Bonus,0,Healthcare & Nursing Jobs,0,0,0,0,1,0,0,0,0,0,0,0,0,0,0
221,Alpha Medical Group,2018-09,Neurology practice strong in Stroke Join this well-established group.,0,Healthcare & Nursing Jobs,0,0,0,0,1,0,0,0,0,0,0,0,0,0,0
222,M/M Recruitment Group,2018-09,Urologist,0,Healthcare & Nursing Jobs,0,0,0,0,1,0,0,0,0,0,0,0,0,0,0
223,Enterprise Medical Recruiting,2018-09,"Family & Internal Medicine needs near Baltimore, MD",0,Healthcare & Nursing Jobs,0,0,0,0,1,0,0,0,0,0,0,0,0,0,0
224,All Star Recruiting,2018-09,Minimally Invasive GYN Surgeon in Maryland,0,Healthcare & Nursing Jobs,0,0,0,0,1,0,0,0,0,0,0,0,0,0,0
225,Source Medical,2018-09,General GI opening on the Maryland Shore,0,Healthcare & Nursing Jobs,0,0,0,0,1,0,0,0,0,0,0,0,0,0,0
226,"Priority Physicians, Inc.",2018-09,GI (EUS & ERCPs not required) on the Eastern Shore,0,Healthcare & Nursing Jobs,0,0,0,0,1,0,0,0,0,0,0,0,0,0,0
227,Source Medical,2018-09,OBGYN - physicians near DC Call averages 1:4 or better,0,Healthcare & Nursing Jobs,0,0,0,0,1,0,0,0,0,0,0,0,0,0,0
228,Continuum Medical Staffing,2018-09,Emergency Medicine Physician Eastern Shore Maryland,0,Healthcare & Nursing Jobs,0,0,0,0,1,0,0,0,0,0,0,0,0,0,0
229,Quest Healthcare Solutions,2018-09,HOSPITALIST | Locums Opportunity in Maryland,0,Healthcare & Nursing Jobs,0,0,0,0,1,0,0,0,0,0,0,0,0,0,0
230,"MHM Services, Inc.",2018-09,Psychiatrist,0,Healthcare & Nursing Jobs,0,0,0,0,1,0,0,0,0,0,0,0,0,0,0
231,LocumTenens.com,2018-09,Locum Tenens OB/GYN Needed in Maryland,0,Healthcare & Nursing Jobs,0,0,0,0,1,0,0,0,0,0,0,0,0,0,0
232,"Priority Physicians, Inc.",2018-09,"Private GI Group (partnership), Pending Retirement, Near Baltimore & DC",0,Healthcare & Nursing Jobs,0,0,0,0,1,0,0,0,0,0,0,0,0,0,0
233,BAS Healthcare,2018-09,Adult Psychiatry 30 mins from the Beach,0,Healthcare & Nursing Jobs,0,0,0,0,1,0,0,0,0,0,0,0,0,0,0
234,BAS Healthcare,2018-09,Psychiatry Opportunity Near Baltimore,0,Healthcare & Nursing Jobs,0,0,0,0,1,0,0,0,0,0,0,0,0,0,0
235,BAS Healthcare,2018-09,Suburban Wash DC OP IM,0,Healthcare & Nursing Jobs,0,0,0,0,1,0,0,0,0,0,0,0,0,0,0
236,BAS Healthcare,2018-09,Outpatient Eating Disorders Psychiatrist Opening IN DC Suburb,0,Healthcare & Nursing Jobs,0,0,0,0,1,0,0,0,0,0,0,0,0,0,0
237,BAS Healthcare,2018-09,Baltimore Adult/Geri Psych Position,0,Healthcare & Nursing Jobs,0,0,0,0,1,0,0,0,0,0,0,0,0,0,0
238,BAS Healthcare,2018-09,Locums Psychiatrist Need - Eastern Shore,0,Healthcare & Nursing Jobs,0,0,0,0,1,0,0,0,0,0,0,0,0,0,0
240,US PHYSICIAN RESOURCES INTL INC,2018-09,Hospitalist Opportunity,0,Healthcare & Nursing Jobs,0,0,0,0,1,0,0,0,0,0,0,0,0,0,0
241,All Star Recruiting,2018-09,Excellent Primary Care Opportunity just North of Washington DC,0,Healthcare & Nursing Jobs,0,0,0,0,1,0,0,0,0,0,0,0,0,0,0
242,"All Medical Personnel, LLC",2018-09,Pediatrics Physician,0,Healthcare & Nursing Jobs,0,0,0,0,1,0,0,0,0,0,0,0,0,0,0
243,Weatherby Healthcare,2018-09,Obstetrics and Gynecology in MD - Locums: An OB/GYN is Needed for Locums Help in Maryland,0,Healthcare & Nursing Jobs,0,0,0,0,1,0,0,0,0,0,0,0,0,0,0
244,"Born & Bicknell, Inc.",2018-09,"Internal Medicine Outpatient Physician Job close to Washington, DC",0,Healthcare & Nursing Jobs,0,0,0,0,1,0,0,0,0,0,0,0,0,0,0
245,"Born & Bicknell, Inc.",2018-09,Urgent Care physician needed in Maryland H1B Visa Candidates Considered,0,Healthcare & Nursing Jobs,0,0,0,0,1,0,0,0,0,0,0,0,0,0,0
246,Source Medical,2018-09,Psychiatrist needed in Maryland,0,Healthcare & Nursing Jobs,0,0,0,0,1,0,0,0,0,0,0,0,0,0,0
247,Enterprise Medical Recruiting,2018-09,"FM/IM Needed in Crofton, MD",0,Healthcare & Nursing Jobs,0,0,0,0,1,0,0,0,0,0,0,0,0,0,0
248,Medicus Healthcare Solutions,2018-09,Psychiatry Coverage Needed in Maryland – Flexible Hours Available,0,Healthcare & Nursing Jobs,0,0,0,0,1,0,0,0,0,0,0,0,0,0,0
249,BAS Healthcare,2018-09,Outpatient Psychiatry Coastal Maryland,0,Healthcare & Nursing Jobs,0,0,0,0,1,0,0,0,0,0,0,0,0,0,0
250,BAS Healthcare,2018-09,LOCUMS-Adult Psychiatrist,0,Healthcare & Nursing Jobs,0,0,0,0,1,0,0,0,0,0,0,0,0,0,0
251,BAS Healthcare,2018-09,General Anesthesiology Position at Prestigious Hospital in Baltimore,0,Healthcare & Nursing Jobs,0,0,0,0,1,0,0,0,0,0,0,0,0,0,0
252,Alpha Medical Group,2018-09,OB/GYN sought to join a hospital employed multi-disciplinary practice.,0,Healthcare & Nursing Jobs,0,0,0,0,1,0,0,0,0,0,0,0,0,0,0
253,BAS Healthcare,2018-09,1hr. Outside of Baltimore & D.C. - Visa's Welcome,0,Healthcare & Nursing Jobs,0,0,0,0,1,0,0,0,0,0,0,0,0,0,0
254,BAS Healthcare,2018-09,Hospitalist minutes to Ocean City,0,Healthcare & Nursing Jobs,0,0,0,0,1,0,0,0,0,0,0,0,0,0,0
255,All Star Recruiting,2018-09,Pediatric Physician,0,Healthcare & Nursing Jobs,0,0,0,0,1,0,0,0,0,0,0,0,0,0,0
256,All Star Recruiting,2018-09,Full-time Gastroenterology opportunity in a great Coastal Maryland community,0,Healthcare & Nursing Jobs,0,0,0,0,1,0,0,0,0,0,0,0,0,0,0
257,All Star Recruiting,2018-09,Employed Nocturnist 7on/7off - Coast of Maryland Areas - Make Over 325K Plus,0,Healthcare & Nursing Jobs,0,0,0,0,1,0,0,0,0,0,0,0,0,0,0
258,Elevate Healthcare Consultants,2018-09,Multiple Psychiatry Positions Nation Wide,0,Healthcare & Nursing Jobs,0,0,0,0,1,0,0,0,0,0,0,0,0,0,0
259,The Medicus Firm,2018-09,MD Urology - $60K Sign-on,0,Healthcare & Nursing Jobs,0,0,0,0,1,0,0,0,0,0,0,0,0,0,0
260,Harris Medical Associates,2018-09,"Locums Psychiatrist 100% Inpatient Adult Services Carroll County, MD",0,Healthcare & Nursing Jobs,0,0,0,0,1,0,0,0,0,0,0,0,0,0,0
261,The Medicus Firm,2018-09,Coastal Mid-Atlantic Pediatrics,0,Healthcare & Nursing Jobs,0,0,0,0,1,0,0,0,0,0,0,0,0,0,0
262,"Born & Bicknell, Inc.",2018-09,Neurologist needed in Maryland H1B or J1 Visa cannot be considered.,0,Healthcare & Nursing Jobs,0,0,0,0,1,0,0,0,0,0,0,0,0,0,0
263,"Born & Bicknell, Inc.",2018-09,Hospitalist needed Eastern Shore of Maryland,0,Healthcare & Nursing Jobs,0,0,0,0,1,0,0,0,0,0,0,0,0,0,0
264,Medicus Healthcare Solutions,2018-09,"Exciting Hospitalist Opportunity Near Ocean City, Maryland – Competitive Compensation",0,Healthcare & Nursing Jobs,0,0,0,0,1,0,0,0,0,0,0,0,0,0,0
265,All Star Recruiting,2018-09,Employed Hospitalist - Coast of Maryland Areas - Make Over 325K Plus,0,Healthcare & Nursing Jobs,0,0,0,0,1,0,0,0,0,0,0,0,0,0,0
266,Enterprise Medical Recruiting,2018-09,Neurology opening just north of Baltimore,0,Healthcare & Nursing Jobs,0,0,0,0,1,0,0,0,0,0,0,0,0,0,0
267,Enterprise Medical Recruiting,2018-09,"Primary Care provider need 12 miles from Washington, DC",0,Healthcare & Nursing Jobs,0,0,0,0,1,0,0,0,0,0,0,0,0,0,0
269,BAS Healthcare,2018-09,Maryland needs Neurologist Stroke or MS a plus,0,Healthcare & Nursing Jobs,0,0,0,0,1,0,0,0,0,0,0,0,0,0,0
270,Weatherby Healthcare,2018-09,Emergency Medicine in MD - Locums: An EM Physician is Needed for Locum Tenens Assistance in Maryland,0,Healthcare & Nursing Jobs,0,0,0,0,1,0,0,0,0,0,0,0,0,0,0
271,All Star Recruiting,2018-09,Neurologist needed in northwest Maryland,0,Healthcare & Nursing Jobs,0,0,0,0,1,0,0,0,0,0,0,0,0,0,0
272,LocumTenens.com,2018-09,Locum Tenens Anesthesiology Coverage in Maryland,0,Healthcare & Nursing Jobs,0,0,0,0,1,0,0,0,0,0,0,0,0,0,0
273,All Star Recruiting,2018-09,Pediatric Emergency Medicine Outpatient Locum Need in MD,0,Healthcare & Nursing Jobs,0,0,0,0,1,0,0,0,0,0,0,0,0,0,0
274,"Born & Bicknell, Inc.",2018-09,A Board Certified Psychiatrist needed in Coastal Maryland,0,Healthcare & Nursing Jobs,0,0,0,0,1,0,0,0,0,0,0,0,0,0,0
275,LocumTenens.com,2018-09,Locum Tenens Psychiatrist Needed in Maryland,0,Healthcare & Nursing Jobs,0,0,0,0,1,0,0,0,0,0,0,0,0,0,0
276,DirectShifts,2018-09,Gastroenterologist needed for new Perm Opportunity in Annapolis MD,0,Healthcare & Nursing Jobs,0,0,0,0,1,0,0,0,0,0,0,0,0,0,0
277,All Star Recruiting,2018-09,Southern Maryland is looking for a Pediatric Hospitalist,0,Healthcare & Nursing Jobs,0,0,0,0,1,0,0,0,0,0,0,0,0,0,0
278,Britt Medical Search,2018-09,Gastroenterology Opening on the East Coast of Maryland – 7 Miles from the Beach New Grads Welcome,0,Healthcare & Nursing Jobs,0,0,0,0,1,0,0,0,0,0,0,0,0,0,0
279,BAS Healthcare,2018-09,Locums Pediatrician Opportunity Available Outside of Washington DC,0,Healthcare & Nursing Jobs,0,0,0,0,1,0,0,0,0,0,0,0,0,0,0
281,Weatherby Healthcare,2018-09,Psychiatry in MD - Locums: Locum Tenens Opportunity in Maryland for Psychiatrist with Day Shifts,0,Healthcare & Nursing Jobs,0,0,0,0,1,0,0,0,0,0,0,0,0,0,0
282,Weatherby Healthcare,2018-09,Psychiatry in MD - Locums: Temporary Opportunity in Maryland for Psychiatrist,0,Healthcare & Nursing Jobs,0,0,0,0,1,0,0,0,0,0,0,0,0,0,0
283,All Star Recruiting,2018-09,OBGYN Position Less than Half an Hour from DC,0,Healthcare & Nursing Jobs,0,0,0,0,1,0,0,0,0,0,0,0,0,0,0
284,LocumTenens.com,2018-09,Locum Tenens Anesthesiologist Needed in Maryland,0,Healthcare & Nursing Jobs,0,0,0,0,1,0,0,0,0,0,0,0,0,0,0
285,"All Medical Personnel, LLC",2018-09,Psychiatry Physician,0,Healthcare & Nursing Jobs,0,0,0,0,1,0,0,0,0,0,0,0,0,0,0
286,"Born & Bicknell, Inc.",2018-09,"IM Outpatient Physician Job close to Washington, DC",0,Healthcare & Nursing Jobs,0,0,0,0,1,0,0,0,0,0,0,0,0,0,0
287,"Med Career Center, Inc",2018-09,BALTIMORE AREA - HOSPITAL EMPLOYED GASTRO,0,Healthcare & Nursing Jobs,0,0,0,0,1,0,0,0,0,0,0,0,0,0,0
288,BAS Healthcare,2018-09,Generalist Openings Minutes to Washington DC,0,Healthcare & Nursing Jobs,0,0,0,0,1,0,0,0,0,0,0,0,0,0,0
289,All Star Recruiting,2018-09,Northern Maryland is seeking an OBGYN,0,Healthcare & Nursing Jobs,0,0,0,0,1,0,0,0,0,0,0,0,0,0,0
290,All Star Recruiting,2018-09,Pulmonary Critical Care position in Western Maryland,0,Healthcare & Nursing Jobs,0,0,0,0,1,0,0,0,0,0,0,0,0,0,0
291,Jackson & Coker,2018-09,Adult Inpatient Psychiatrist Locums Job in Maryland,0,Healthcare & Nursing Jobs,0,0,0,0,1,0,0,0,0,0,0,0,0,0,0
292,BAS Healthcare,2018-09,Consult Psychiatry Coverage - Maryland,0,Healthcare & Nursing Jobs,0,0,0,0,1,0,0,0,0,0,0,0,0,0,0
293,Source Medical,2018-09,"Gastroenterology, salary plus incentives, malpractice and more",0,Healthcare & Nursing Jobs,0,0,0,0,1,0,0,0,0,0,0,0,0,0,0
294,Weatherby Healthcare,2018-09,Hospitalist in MD - Locums: A Maryland Facility Needs a Locums Hospitalist,0,Healthcare & Nursing Jobs,0,0,0,0,1,0,0,0,0,0,0,0,0,0,0
295,BAS Healthcare,2018-09,Hospitalist Openings at a Top Maryland Hospital Easy access to Baltimore and Pittsburgh,0,Healthcare & Nursing Jobs,0,0,0,0,1,0,0,0,0,0,0,0,0,0,0
296,Enterprise Medical Recruiting,2018-09,Maryland - Hospitalist Opening,0,Healthcare & Nursing Jobs,0,0,0,0,1,0,0,0,0,0,0,0,0,0,0
297,Harris Medical Associates,2018-09,Locums Psychiatrist Outpatient Clinic near City in Mariland,0,Healthcare & Nursing Jobs,0,0,0,0,1,0,0,0,0,0,0,0,0,0,0
298,"Med Career Center, Inc",2018-09,"LABORIST needed near Baltimore, MD",0,Healthcare & Nursing Jobs,0,0,0,0,1,0,0,0,0,0,0,0,0,0,0
299,Enterprise Medical Recruiting,2018-09,"Family & Internal Medicine needs Elkridge/Laurel, MD",0,Healthcare & Nursing Jobs,0,0,0,0,1,0,0,0,0,0,0,0,0,0,0
300,All Star Recruiting,2018-09,Full Time Anesthesiologist needed in Western Maryland,0,Healthcare & Nursing Jobs,0,0,0,0,1,0,0,0,0,0,0,0,0,0,0
301,Enterprise Medical Recruiting,2018-09,Nocturnist - Washington DC - University of Maryland,0,Healthcare & Nursing Jobs,0,0,0,0,1,0,0,0,0,0,0,0,0,0,0
303,Jackson & Coker,2018-09,Any State License | Telepsychiatry | Locums Job,0,Healthcare & Nursing Jobs,0,0,0,0,1,0,0,0,0,0,0,0,0,0,0
304,Jackson & Coker,2018-09,Psychiatrist | Inpatient Locums Job | North of D.C. | Maryland,0,Healthcare & Nursing Jobs,0,0,0,0,1,0,0,0,0,0,0,0,0,0,0
305,Jackson & Coker,2018-09,New Neuropsychiatry Locums Job in Maryland,0,Healthcare & Nursing Jobs,0,0,0,0,1,0,0,0,0,0,0,0,0,0,0
306,Enterprise Medical Recruiting,2018-09,Family or Internal Medicine needs in Baltimore Suburbs,0,Healthcare & Nursing Jobs,0,0,0,0,1,0,0,0,0,0,0,0,0,0,0
307,Continuum Medical Staffing,2018-09,Anesthesiologist Cumberland Maryland,0,Healthcare & Nursing Jobs,0,0,0,0,1,0,0,0,0,0,0,0,0,0,0
308,Continuum Medical Staffing,2018-09,HOSPITALIST EASTERN SHORE MARYLAND,0,Healthcare & Nursing Jobs,0,0,0,0,1,0,0,0,0,0,0,0,0,0,0
309,Enterprise Medical Recruiting,2018-09,"Family and Internal Medicine need in Hagerstown, MD",0,Healthcare & Nursing Jobs,0,0,0,0,1,0,0,0,0,0,0,0,0,0,0
310,BAS Healthcare,2018-09,Suburban Washington DC Psych Openings,0,Healthcare & Nursing Jobs,0,0,0,0,1,0,0,0,0,0,0,0,0,0,0
311,MDstaffers,2018-09,Telemedicine Physician (Maryland),0,Healthcare & Nursing Jobs,0,0,0,0,1,0,0,0,0,0,0,0,0,0,0
313,M/M Recruitment Group,2018-09,Neurology,0,Healthcare & Nursing Jobs,0,0,0,0,1,0,0,0,0,0,0,0,0,0,0
314,M/M Recruitment Group,2018-09,Psychiatrist,0,Healthcare & Nursing Jobs,0,0,0,0,1,0,0,0,0,0,0,0,0,0,0
315,All Star Recruiting,2018-09,"Amazing Palliative Care opportunity outside of Winchester, VA",0,Healthcare & Nursing Jobs,0,0,0,0,1,0,0,0,0,0,0,0,0,0,0
316,Weatherby Healthcare,2018-09,Psychiatry in MD - Locums: A Maryland Facility is Searching for a Locums Psychiatrist,0,Healthcare & Nursing Jobs,0,0,0,0,1,0,0,0,0,0,0,0,0,0,0
317,Source Medical,2018-09,Psychiatry Opening - Maryland - $300k Base Salary Potential,0,Healthcare & Nursing Jobs,0,0,0,0,1,0,0,0,0,0,0,0,0,0,0
318,Enterprise Medical Recruiting,2018-09,Employed Baltimore Neurology Opening,0,Healthcare & Nursing Jobs,0,0,0,0,1,0,0,0,0,0,0,0,0,0,0
319,BAS Healthcare,2018-09,Hospitalist Position with Access to DC and B-more,0,Healthcare & Nursing Jobs,0,0,0,0,1,0,0,0,0,0,0,0,0,0,0
320,All Star Recruiting,2018-09,Ongoing Emergency Medicine Locums Need in Maryland,0,Healthcare & Nursing Jobs,0,0,0,0,1,0,0,0,0,0,0,0,0,0,0
321,MedSource Consultants,2018-09,Child and Adolescent Psychiatrist,0,Healthcare & Nursing Jobs,0,0,0,0,1,0,0,0,0,0,0,0,0,0,0
322,BAS Healthcare,2018-09,Western Maryland Locum Psychiatry,0,Healthcare & Nursing Jobs,0,0,0,0,1,0,0,0,0,0,0,0,0,0,0
323,Medicus Healthcare Solutions,2018-09,Three Day Work Week - Emergency Medicine Opportunity in Maryland,0,Healthcare & Nursing Jobs,0,0,0,0,1,0,0,0,0,0,0,0,0,0,0
324,The Delta Companies,2018-09,Family Medicine (FM) - Locum Tenens - Maryland - 133629-2,0,Healthcare & Nursing Jobs,0,0,0,0,1,0,0,0,0,0,0,0,0,0,0
325,Enterprise Medical Recruiting,2018-09,"Expanding Private Practice located in DC, MD, and VA - Partnership Opportunity",0,Healthcare & Nursing Jobs,0,0,0,0,1,0,0,0,0,0,0,0,0,0,0
326,All Star Recruiting,2018-09,Cardiac Anesthesiologist needed,0,Healthcare & Nursing Jobs,0,0,0,0,1,0,0,0,0,0,0,0,0,0,0
327,The Medicus Firm,2018-09,Outpatient Consult Neurology,0,Healthcare & Nursing Jobs,0,0,0,0,1,0,0,0,0,0,0,0,0,0,0
328,Alpha Medical Group,2018-09,Urologist needed to join a private practice on a partnership track.,0,Healthcare & Nursing Jobs,0,0,0,0,1,0,0,0,0,0,0,0,0,0,0
329,Enterprise Medical Recruiting,2018-09,Family and Internal Medicine needs in - Westminster/ Taneytown,0,Healthcare & Nursing Jobs,0,0,0,0,1,0,0,0,0,0,0,0,0,0,0
331,Alliance Recruiting Resources,2018-09,PERM HOSPITALIST,0,Healthcare & Nursing Jobs,0,0,0,0,1,0,0,0,0,0,0,0,0,0,0
332,Signify Health,2018-09,Extremely Flexible and Lucrative Work Opportunity for Full-time or Part-time,0,Healthcare & Nursing Jobs,0,0,0,0,1,0,0,0,0,0,0,0,0,0,0
333,Quest Healthcare Solutions,2018-09,Hospitalist | Locum Tenens Job in Maryland,0,Healthcare & Nursing Jobs,0,0,0,0,1,0,0,0,0,0,0,0,0,0,0
334,BAS Healthcare,2018-09,Johns Hopkins Adult IP Opening,0,Healthcare & Nursing Jobs,0,0,0,0,1,0,0,0,0,0,0,0,0,0,0
335,BAS Healthcare,2018-09,LOCUMS-Adult Psychiatrist (ACT),0,Healthcare & Nursing Jobs,0,0,0,0,1,0,0,0,0,0,0,0,0,0,0
336,Weatherby Healthcare,2018-09,Emergency Medicine in MD - Locums: An Emergency Medicine Physician is Needed for Temporary Coverage in MD,0,Healthcare & Nursing Jobs,0,0,0,0,1,0,0,0,0,0,0,0,0,0,0
337,Weatherby Healthcare,2018-09,Psychiatry in MD - Locums: Locum Tenens Coverage Opportunity for a Psychiatrist in Maryland,0,Healthcare & Nursing Jobs,0,0,0,0,1,0,0,0,0,0,0,0,0,0,0
338,All Star Recruiting,2018-09,Neurologist needed in coastal Maryland,0,Healthcare & Nursing Jobs,0,0,0,0,1,0,0,0,0,0,0,0,0,0,0
339,"Med Career Center, Inc",2018-09,Neurologist near Baltimore MD,0,Healthcare & Nursing Jobs,0,0,0,0,1,0,0,0,0,0,0,0,0,0,0
340,Source Medical,2018-09,Coastal Maryland / Hospitalist - FM or IM / Total Comp around $260K,0,Healthcare & Nursing Jobs,0,0,0,0,1,0,0,0,0,0,0,0,0,0,0
341,Quest Healthcare Solutions,2018-09,Locums Psychiatry Opportunity | Weekend Locum Coverage Needed in Maryland,0,Healthcare & Nursing Jobs,0,0,0,0,1,0,0,0,0,0,0,0,0,0,0
342,Goldfish Medical Staffing,2018-09,Coastal Maryland Hospitalist Opportunity - Beach Resort (13511 LH),0,Healthcare & Nursing Jobs,0,0,0,0,1,0,0,0,0,0,0,0,0,0,0
343,Integrity Locums,2018-09,Locum Psychiatry Need in Maryland,0,Healthcare & Nursing Jobs,0,0,0,0,1,0,0,0,0,0,0,0,0,0,0
344,Medicus Healthcare Solutions,2018-09,Anesthesiologist Needed in Maryland - Paid Travel and Lodging,0,Healthcare & Nursing Jobs,0,0,0,0,1,0,0,0,0,0,0,0,0,0,0
345,Jackson & Coker,2018-09,Inpatient Psychiatry Locums Job in Maryland,0,Healthcare & Nursing Jobs,0,0,0,0,1,0,0,0,0,0,0,0,0,0,0
346,Jackson & Coker,2018-09,"Part-time Psychiatry | Washington, DC area | Locum Tenens",0,Healthcare & Nursing Jobs,0,0,0,0,1,0,0,0,0,0,0,0,0,0,0
347,"Med Career Center, Inc",2018-09,"Full or Part Time, near Baltimore",0,Healthcare & Nursing Jobs,0,0,0,0,1,0,0,0,0,0,0,0,0,0,0
348,Alliance Recruiting Resources,2018-09,Weekend Inpatient Psychiatrist Coverage Needed in the Baltimore Maryland ar,0,Healthcare & Nursing Jobs,0,0,0,0,1,0,0,0,0,0,0,0,0,0,0
349,Integrity Healthcare,2018-09,Permanent Nocturnist Physician - Maryland DC Suburbs,0,Healthcare & Nursing Jobs,0,0,0,0,1,0,0,0,0,0,0,0,0,0,0
350,Weatherby Healthcare,2018-09,Emergency Medicine in MD - Locums: An Emergency Medicine Physician is Required for Locums Coverage in Maryland,0,Healthcare & Nursing Jobs,0,0,0,0,1,0,0,0,0,0,0,0,0,0,0
351,Integrity Healthcare,2018-09,Internal Medicine Physician in Maryland - Washington DC Suburbs,0,Healthcare & Nursing Jobs,0,0,0,0,1,0,0,0,0,0,0,0,0,0,0
352,Weatherby Healthcare,2018-09,Psychiatry in MD - Locums: A Locums Psychiatrist is Needed in Maryland,0,Healthcare & Nursing Jobs,0,0,0,0,1,0,0,0,0,0,0,0,0,0,0
353,All Star Recruiting,2018-09,IP Psych Opportunity in Maryland,0,Healthcare & Nursing Jobs,0,0,0,0,1,0,0,0,0,0,0,0,0,0,0
354,"All Medical Personnel, LLC",2018-09,Anesthesiology Physician,0,Healthcare & Nursing Jobs,0,0,0,0,1,0,0,0,0,0,0,0,0,0,0
355,Weatherby Healthcare,2018-09,Critical Care Medicine in MD - Locums: A Critical Care Medicine Physician is Needed for Locums Coverage in Maryland,0,Healthcare & Nursing Jobs,0,0,0,0,1,0,0,0,0,0,0,0,0,0,0
356,Weatherby Healthcare,2018-09,Obstetrics and Gynecology in MD - Locums: Obstetrics/Gynecology Position in Maryland ASAP,0,Healthcare & Nursing Jobs,0,0,0,0,1,0,0,0,0,0,0,0,0,0,0
357,Jackson & Coker,2018-09,Part-time Psychiatrist Medical Director Locums Job | Less than 30 minutes from DC in Maryland,0,Healthcare & Nursing Jobs,0,0,0,0,1,0,0,0,0,0,0,0,0,0,0
358,Jackson & Coker,2018-09,Adult Inpatient Psychiatry Locums Job | Western Maryland,0,Healthcare & Nursing Jobs,0,0,0,0,1,0,0,0,0,0,0,0,0,0,0
359,BAS Healthcare,2018-09,Associate Director of Adult Behavioral Health Needed,0,Healthcare & Nursing Jobs,0,0,0,0,1,0,0,0,0,0,0,0,0,0,0
360,BAS Healthcare,2018-09,Adult Psychiatry Opportunity Minutes from Washington DC,0,Healthcare & Nursing Jobs,0,0,0,0,1,0,0,0,0,0,0,0,0,0,0
361,The Delta Companies,2018-09,Psychiatry (PSY) - Locum Tenens - Maryland - 136493,0,Healthcare & Nursing Jobs,0,0,0,0,1,0,0,0,0,0,0,0,0,0,0
362,Weatherby Healthcare,2018-09,Psychiatry in MD - Locums: A Locums Psychiatrist is Wanted in Maryland,0,Healthcare & Nursing Jobs,0,0,0,0,1,0,0,0,0,0,0,0,0,0,0
363,Continuum Medical Staffing,2018-09,Urology Southern Maryland,0,Healthcare & Nursing Jobs,0,0,0,0,1,0,0,0,0,0,0,0,0,0,0
364,Enterprise Medical Recruiting,2018-09,Seeking Nocturnist in the DC Metro Area,0,Healthcare & Nursing Jobs,0,0,0,0,1,0,0,0,0,0,0,0,0,0,0
365,LocumTenens.com,2018-09,Locum Tenens Weekend Psychiatrist Needed in Maryland,0,Healthcare & Nursing Jobs,0,0,0,0,1,0,0,0,0,0,0,0,0,0,0
366,The Delta Companies,2018-09,Psychiatry (PSY) - Locum Tenens - Maryland - 136488,0,Healthcare & Nursing Jobs,0,0,0,0,1,0,0,0,0,0,0,0,0,0,0
367,DELL,2018-09,Senior Advisor-Product Management-Cloud Compute Services,0,Consultancy Jobs,0,0,1,0,0,0,0,0,0,0,0,0,0,0,0
368,"Hayman Daugherty Associates, Inc",2018-10,Emergency Medicine Physician Job Maryland,0,Healthcare & Nursing Jobs,0,0,0,0,1,0,0,0,0,0,0,0,0,0,0
373,"Hayman Daugherty Associates, Inc",2018-10,Emergency Medicine Physician North DC,0,Healthcare & Nursing Jobs,0,0,0,0,1,0,0,0,0,0,0,0,0,0,0
377,"Hayman Daugherty Associates, Inc",2018-10,New emergency medicine opening in the suburbs of DC Busy community ED is adding an emergency medicine trained physician to thei,0,Healthcare & Nursing Jobs,0,0,0,0,1,0,0,0,0,0,0,0,0,0,0
378,"Hayman Daugherty Associates, Inc",2018-10,ObGyn Physician Job Maryland,0,Healthcare & Nursing Jobs,0,0,0,0,1,0,0,0,0,0,0,0,0,0,0
380,"Hayman Daugherty Associates, Inc",2018-10,Internal Medicine physician in Western Maryland,0,Healthcare & Nursing Jobs,0,0,0,0,1,0,0,0,0,0,0,0,0,0,0
381,"Hayman Daugherty Associates, Inc",2018-10,"New PARTNERSHIP OPPORTUNITY with a long-standing, private democratic group in a beautiful area of Maryland close to the coast",0,Healthcare & Nursing Jobs,0,0,0,0,1,0,0,0,0,0,0,0,0,0,0
382,"Hayman Daugherty Associates, Inc",2018-10,Emergency Medicine Physician Washington DC,0,Healthcare & Nursing Jobs,0,0,0,0,1,0,0,0,0,0,0,0,0,0,0
383,"Hayman Daugherty Associates, Inc",2018-10,Emergency Medicine Outside DC Beltline,0,Healthcare & Nursing Jobs,0,0,0,0,1,0,0,0,0,0,0,0,0,0,0
384,Alliance Recruiting Resources,2018-10,Northwestern Maryland â€“ Seeks BC EM for locums or locums-to perm. On-Going,0,Healthcare & Nursing Jobs,0,0,0,0,1,0,0,0,0,0,0,0,0,0,0
385,Onyx M.D.,2018-10,PERM Pediatric Hospitalist Job Opportunity in Maryland for Call Coverage,0,Healthcare & Nursing Jobs,0,0,0,0,1,0,0,0,0,0,0,0,0,0,0
386,Onyx M.D.,2018-10,Maryland Locum Tenens Psychiatrist Opportunity Near Baltimore - Weekend Shifts,0,Healthcare & Nursing Jobs,0,0,0,0,1,0,0,0,0,0,0,0,0,0,0
387,BAS Healthcare,2018-10,Full time Weekend Adult IP Opening,0,Healthcare & Nursing Jobs,0,0,0,0,1,0,0,0,0,0,0,0,0,0,0
388,BAS Healthcare,2018-10,Top Tier Gastro Opportunity in Annapolis,0,Healthcare & Nursing Jobs,0,0,0,0,1,0,0,0,0,0,0,0,0,0,0
389,BAS Healthcare,2018-10,Psychiatric Medical Director Suburban Maryland,0,Healthcare & Nursing Jobs,0,0,0,0,1,0,0,0,0,0,0,0,0,0,0
390,Hearst Television,2018-10,Account Executive,0,"PR, Advertising & Marketing Jobs",0,0,0,0,0,0,0,0,0,1,0,0,0,0,0
391,Fairway Consulting Group,2018-10,"CEO, Respiratory Asset",0,Unknown,0,0,0,0,0,0,0,0,0,0,0,0,0,0,1
392,Ensearch,2018-10,1776 | NNP in Maryland,0,Unknown,0,0,0,0,0,0,0,0,0,0,0,0,0,0,1
393,Hearst Television,2018-10,Executive Producer,0,"PR, Advertising & Marketing Jobs",0,0,0,0,0,0,0,0,0,1,0,0,0,0,0
394,Icon,2018-10,"(Senior) Principal Scientist, Patient Centered Outcomes",0,Scientific & QA Jobs,0,0,0,0,0,0,0,0,0,0,0,0,1,0,0
395,elastic,2018-11,Sales Director - Federal,0,IT Jobs,0,0,0,0,0,1,0,0,0,0,0,0,0,0,0
396,Icon,2018-11,"Director, Project Management (Internal Medicine)",0,Healthcare & Nursing Jobs,0,0,0,0,1,0,0,0,0,0,0,0,0,0,0
397,Merck KGaA,2018-11,"Medical Science Liaison, Neurology and Immunology (Mid Atlantic East - MD, DE)",0,Healthcare & Nursing Jobs,0,0,0,0,1,0,0,0,0,0,0,0,0,0,0
398,"Hanover Insurance Group, Inc.",2018-11,MM - Southeast Region-MM Sr Sales Underwriting Specialist,0,Accounting & Finance Jobs,1,0,0,0,0,0,0,0,0,0,0,0,0,0,0
399,Perspecta Inc.,2018-11,Cyber Systems Engineer Senior Technical Specialist,0,IT Jobs,0,0,0,0,0,1,0,0,0,0,0,0,0,0,0
400,Perspecta Inc.,2018-11,Database Architect Technical Specialist,0,IT Jobs,0,0,0,0,0,1,0,0,0,0,0,0,0,0,0
401,"NBCUniversal, Inc.",2018-11,Photographer- NBC Sports Washington,0,"PR, Advertising & Marketing Jobs",0,0,0,0,0,0,0,0,0,1,0,0,0,0,0
