,company,created_date,title,salary,sector
532,Enterprise Medical Recruiting,2018-09-28,"Orlando, FL Area Outpatient Primary Care Position",0,Healthcare & Nursing Jobs
533,Enterprise Medical Recruiting,2018-09-28,"Tallahassee, FL Outpatient Internal Medicine Position",0,Healthcare & Nursing Jobs
534,Samuel Contract Staffing,2018-09-28,Gastroenterologist Needed Full Time in Florida,0,Healthcare & Nursing Jobs
535,KPS Physician Staffing,2018-09-28,Primary Care Opportunity on Florida's Emerald Coast,0,Healthcare & Nursing Jobs
536,NHR,2018-09-28,"Neuro Hospitalist Physician needed near Orlando, FL",0,Healthcare & Nursing Jobs
537,Physician Providers Mgmt. Corp.,2018-09-28,IM / FP - (Men's Health) Locums Oppty in both VA & FL,0,Healthcare & Nursing Jobs
538,Physician Providers Mgmt. Corp.,2018-09-28,IM / FP for North FLorida,0,Healthcare & Nursing Jobs
540,BAS Healthcare,2018-09-28,Pediatric Opening in Florida's State Capital,0,Healthcare & Nursing Jobs
541,Enterprise Medical Recruiting,2018-09-28,Internist needed Near Tampa,0,Healthcare & Nursing Jobs
542,Enterprise Medical Recruiting,2018-09-28,"Internal Medicine position needed in Metro Southwest, Florida",0,Healthcare & Nursing Jobs
543,Enterprise Medical Recruiting,2018-09-28,"Internal Medicine need near Jacksonville, FL",0,Healthcare & Nursing Jobs
544,Enterprise Medical Recruiting,2018-09-28,Urgent Care needs in Coastal Florida,0,Healthcare & Nursing Jobs
545,Physician Providers Mgmt. Corp.,2018-09-28,"Pediatrician for Out-Patient, Close to Keys, FL.",0,Healthcare & Nursing Jobs
546,Enterprise Medical Recruiting,2018-09-28,"Adding an Internist for Outpatient practice North Central, Florida",0,Healthcare & Nursing Jobs
547,Enterprise Medical Recruiting,2018-09-28,Adding an internist to an ambulatory practice in North Florida,0,Healthcare & Nursing Jobs
548,Enterprise Medical Recruiting,2018-09-28,Well-Established Employed Primary Care group seeks Internal Medicine physician,0,Healthcare & Nursing Jobs
549,Enterprise Medical Recruiting,2018-09-28,Adding an Internist for an associate residency program director position,0,Healthcare & Nursing Jobs
550,NHR,2018-09-28,SW Coastal FL is seeking Internal Medicine Physician,0,Healthcare & Nursing Jobs
551,Physician Services,2018-09-28,"Internal Medicine, Florida,",0,Healthcare & Nursing Jobs
552,Enterprise Medical Recruiting,2018-09-28,FM/IM need in Tampa suburb,0,Healthcare & Nursing Jobs
553,One Stop Recruiting,2018-09-28,"Primary Care Physician needed in Florida- Highly Competitive Salary, PTO Plus more",0,Healthcare & Nursing Jobs
554,"DOCTORS CHOICE PLACEMENT SERVICES, INC.",2018-09-28,Take Over Pediatric Practice Along Florida Gulf Coast,0,Healthcare & Nursing Jobs
555,"DOCTORS CHOICE PLACEMENT SERVICES, INC.",2018-09-28,"ENT Position in Saint Petersburg, Florida",0,Healthcare & Nursing Jobs
556,Continuum Medical Staffing,2018-09-28,Gastroenterologist Sarasota Florida,0,Healthcare & Nursing Jobs
557,TeamHealth,2018-09-28,Post-Acute Physician,0,Healthcare & Nursing Jobs
558,"DOCTORS CHOICE PLACEMENT SERVICES, INC.",2018-09-28,Join Established GI Practice Along Florida Gulf Coast,0,Healthcare & Nursing Jobs
559,"Consilium Staffing, LLC",2018-09-28,"Hiring Locum Tenens Psychiatrist, Inpatient—Florida",0,Healthcare & Nursing Jobs
560,All Star Recruiting,2018-09-28,OBGYN Job with coastal living,0,Healthcare & Nursing Jobs
561,Physician Providers Mgmt. Corp.,2018-09-28,Gastroenterologist wanted in FL (4 locations to choose from),0,Healthcare & Nursing Jobs
562,Enterprise Medical Recruiting,2018-09-28,Interviewing Urologist for Central Florida,0,Healthcare & Nursing Jobs
563,Enterprise Medical Recruiting,2018-09-28,2 Physicians needed in Southeast FL,0,Healthcare & Nursing Jobs
564,Enterprise Medical Recruiting,2018-09-28,Palm Beach County - Psychiatry,0,Healthcare & Nursing Jobs
565,Physician Providers Mgmt. Corp.,2018-09-28,Amazing Opportunity for Pediatrician in Sunny South Florida,0,Healthcare & Nursing Jobs
567,"DOCTORS CHOICE PLACEMENT SERVICES, INC.",2018-09-28,OB/GYN Opportunity in Southeast Alabama,0,Healthcare & Nursing Jobs
568,Physician Providers Mgmt. Corp.,2018-09-28,OBGYN wanted near the Boca/Lauderdale area - FL.,0,Healthcare & Nursing Jobs
569,KPS Physician Staffing,2018-09-28,Orlando Area Hospitalist Position Available Now,0,Healthcare & Nursing Jobs
570,Enterprise Medical Recruiting,2018-09-28,Central Florida - Inpatient Psychiatry,0,Healthcare & Nursing Jobs
571,Enterprise Medical Recruiting,2018-09-28,Psychiatry-Addiction Practice Available in Tallahassee,0,Healthcare & Nursing Jobs
572,"Hayman Daugherty Associates, Inc",2018-09-28,"OBGYN in Ft. Lauderdale, FL",0,Healthcare & Nursing Jobs
573,Enterprise Medical Recruiting,2018-09-28,Coastal South Florida-Seeking Psychiatrists for Employed Practice,0,Healthcare & Nursing Jobs
574,"Hayman Daugherty Associates, Inc",2018-09-28,"Primary Care Physician Job Near Ft. Lauderdale, Florida",0,Healthcare & Nursing Jobs
575,Enterprise Medical Recruiting,2018-09-28,"Leesburg, FL Area Internal Medicine Position",0,Healthcare & Nursing Jobs
576,Enterprise Medical Recruiting,2018-09-28,"Hospital Employed Outpatient Internal Medicine Position, Tallahassee, FL",0,Healthcare & Nursing Jobs
577,Continuum Medical Staffing,2018-09-28,Psychiatry Pensacola Florida,0,Healthcare & Nursing Jobs
578,Enterprise Medical Recruiting,2018-09-28,"Miami, Florida Established Medical Center seeks a Neurologist",0,Healthcare & Nursing Jobs
579,NHR,2018-09-28,"Outpatient IM need - SW Coastal Florida ($200,000 to $248,000 plus productivity and $15,000 to $20,000 sign on bonus)",0,Healthcare & Nursing Jobs
580,Goldfish Medical Staffing,2018-09-28,Florida GI Private Practice Opportunity (11456 LM),0,Healthcare & Nursing Jobs
581,Enterprise Medical Recruiting,2018-09-28,Outpatient Practice in North Florida - Loan Repayment Available,0,Healthcare & Nursing Jobs
582,Enterprise Medical Recruiting,2018-09-28,"Outpatient Internal Medicine Positions, Tampa Bay, FL Area",0,Healthcare & Nursing Jobs
583,National Health Partners,2018-09-28,"35 – Minutes to Columbia, South Carolina seeking Pediatrician",0,Healthcare & Nursing Jobs
584,Enterprise Medical Recruiting,2018-09-28,"Adding an Internist for teaching position North Central, Florida",0,Healthcare & Nursing Jobs
585,"DOCTORS CHOICE PLACEMENT SERVICES, INC.",2018-09-28,Outpatient Pediatrics Opportunity - East Coast Florida,0,Healthcare & Nursing Jobs
586,LocumTenens.com,2018-09-28,Locum Tenens Gastroenterology Call Coverage Needed in Florida,0,Healthcare & Nursing Jobs
587,"Med Career Center, Inc",2018-09-28,GASTRO needed - west coast of FLORIDA,0,Healthcare & Nursing Jobs
588,"Med Career Center, Inc",2018-09-28,Central FL - Near Coast,0,Healthcare & Nursing Jobs
589,"Med Career Center, Inc",2018-09-28,Wanting an IM Physician in FL,0,Healthcare & Nursing Jobs
590,"Med Career Center, Inc",2018-09-28,Seeking an IM in FL,0,Healthcare & Nursing Jobs
591,"Med Career Center, Inc",2018-09-28,Near Naples,0,Healthcare & Nursing Jobs
593,Gammons Group,2018-09-28,Lucrative Compensation - Neurology Position - Metro North Florida Location,0,Healthcare & Nursing Jobs
594,Enterprise Medical Recruiting,2018-09-28,Tampa - Emergency Medicine Opening,0,Healthcare & Nursing Jobs
595,"DOCTORS CHOICE PLACEMENT SERVICES, INC.",2018-09-28,"Primary Care Physicians Needed In St. Petersburg, Florida",0,Healthcare & Nursing Jobs
596,"The Stembridge Agency, LLC",2018-09-28,"OB/GYN needed in Port St. Lucie, FL (SA197343)",0,Healthcare & Nursing Jobs
597,Enterprise Medical Recruiting,2018-09-28,"Internal Medicine need in The Villages, FL",0,Healthcare & Nursing Jobs
598,"Consilium Staffing, LLC",2018-09-28,"Hiring Locum Tenens Outpatient Psychiatrist—Miami, Florida",0,Healthcare & Nursing Jobs
599,"Hayman Daugherty Associates, Inc",2018-09-28,Internal Medicine Physician Needed in North Florida,0,Healthcare & Nursing Jobs
600,Enterprise Medical Recruiting,2018-09-28,Pain Management position in Winter Haven Florida,0,Healthcare & Nursing Jobs
601,"Hayman Daugherty Associates, Inc",2018-09-28,"OBGYN near Port St. Lucie, FL",0,Healthcare & Nursing Jobs
602,Source Medical,2018-09-28,"Port St. Lucie, FL / Urgent Care / Procedure Oriented Setting",0,Healthcare & Nursing Jobs
603,"Hayman Daugherty Associates, Inc",2018-09-28,"Psychiatry Physician Job Near Ft. Lauderdale, Florida",0,Healthcare & Nursing Jobs
604,BAS Healthcare,2018-09-28,Work in Florida's Largest Emergency Department,0,Healthcare & Nursing Jobs
605,"Southeast Physician Search, Inc.",2018-09-28,St. Petersburg Opportunity,0,Healthcare & Nursing Jobs
606,"Med Consulting Partners, INC",2018-09-28,"Looking for Part Time MD/DOs for Ongoing Locums Coverage at Men's Clinics in Boca Raton and Fort Myers, FL Starting ASAP",0,Healthcare & Nursing Jobs
607,"Hayman Daugherty Associates, Inc",2018-09-28,"Internal Medicine near Ft. Lauderdale, FL",0,Healthcare & Nursing Jobs
608,"All HealthCare Staffing, LLC",2018-09-28,SW Florida - Gastroenterology Opportunity with Partner Track Option,0,Healthcare & Nursing Jobs
609,"Med Career Center, Inc",2018-09-28,"COASTAL FLORIDA, Desirable area",0,Healthcare & Nursing Jobs
610,"Med Career Center, Inc",2018-09-28,IM needed in FL,0,Healthcare & Nursing Jobs
611,"Consilium Staffing, LLC",2018-09-28,Hiring Locum Tenens Adult Psychiatrist—Florida,0,Healthcare & Nursing Jobs
612,Enterprise Medical Recruiting,2018-09-28,"Psychiatric Medical Director in Jacksonville, Florida",0,Healthcare & Nursing Jobs
613,Integrity Healthcare,2018-09-28,"Internal Medicine Physician Need in Daytona Beach, Florida",0,Healthcare & Nursing Jobs
615,"Hayman Daugherty Associates, Inc",2018-09-28,Gastroenterology in the Florida Panhandle,0,Healthcare & Nursing Jobs
616,Enterprise Medical Recruiting,2018-09-28,Psychiatry with the Nation's Leading Telemedicine Company,0,Healthcare & Nursing Jobs
617,Enterprise Medical Recruiting,2018-09-28,"Outpatient Internal Medicine Position, Tallahassee, FL",0,Healthcare & Nursing Jobs
618,Enterprise Medical Recruiting,2018-09-28,Adding a Internist in Orlando area,0,Healthcare & Nursing Jobs
619,"Hayman Daugherty Associates, Inc",2018-09-28,OBGYN Needed in Florida,0,Healthcare & Nursing Jobs
620,"Hayman Daugherty Associates, Inc",2018-09-28,Southwest Florida Practice Seeking 2 Gastroenterologists,0,Healthcare & Nursing Jobs
621,Enterprise Medical Recruiting,2018-09-28,"Internal Medicine Position in Perry, FL",0,Healthcare & Nursing Jobs
622,Enterprise Medical Recruiting,2018-09-28,Urgent Care practice along Florida?s Emerald Coast,0,Healthcare & Nursing Jobs
623,Enterprise Medical Recruiting,2018-09-28,Northeast Florida Group Adding OB/GYN,0,Healthcare & Nursing Jobs
624,Enterprise Medical Recruiting,2018-09-28,Family Medicine/Urgent Care - Emerald Coast of Florida,0,Healthcare & Nursing Jobs
625,Enterprise Medical Recruiting,2018-09-28,Tallahassee - Child Psychiatry Openings - Work/Life Balance,0,Healthcare & Nursing Jobs
626,Enterprise Medical Recruiting,2018-09-28,Urologist Needed in West Coastal Florida,0,Healthcare & Nursing Jobs
627,Medicus Healthcare Solutions,2018-09-28,Emergency Medicine Physician Opportunity in Coastal Florida,0,Healthcare & Nursing Jobs
628,Enterprise Medical Recruiting,2018-09-28,"Leesburg, FL Outpatient Internal Medicine Position",0,Healthcare & Nursing Jobs
629,Universal Health Services,2018-09-28,"Internal Medicine opportunity – Lakewood Ranch, FL",0,Healthcare & Nursing Jobs
630,Enterprise Medical Recruiting,2018-09-28,Adding an Internist to be Assistant Medical Director for a residency program,0,Healthcare & Nursing Jobs
631,Enterprise Medical Recruiting,2018-09-28,"Daytona, Beach, FL Outpatient Primary Care Position",0,Healthcare & Nursing Jobs
632,Pacific Companies,2018-09-28,Weekend Coverage – GI Hospital Coverage Needed – Locum Tenens,0,Healthcare & Nursing Jobs
633,"DOCTORS CHOICE PLACEMENT SERVICES, INC.",2018-09-28,Gastroenterology Opening in Central Florida,0,Healthcare & Nursing Jobs
634,BAS Healthcare,2018-09-28,Adult Psychiatry Available in Florida's Capital,0,Healthcare & Nursing Jobs
635,Goldfish Medical Staffing,2018-09-28,Florida Inpatient Psychiatry Opportunity (12586 ME),0,Healthcare & Nursing Jobs
636,Physician Providers Mgmt. Corp.,2018-09-28,Ob/Gyn for FL - 3 different locations to choose from,0,Healthcare & Nursing Jobs
637,Source Medical,2018-09-28,"(Lake County, FL) BC IM needed for Traditional or OP Only",0,Healthcare & Nursing Jobs
638,Integrity Healthcare,2018-09-28,BC/BE Child/Adolescent Psychiatrists needed - Treasure Coast of Florida,0,Healthcare & Nursing Jobs
639,Source Medical,2018-09-28,Internal Medicine,0,Healthcare & Nursing Jobs
640,Goldfish Medical Staffing,2018-09-28,Florida OBGYN Opportunity (12846 LH),0,Healthcare & Nursing Jobs
641,Alliance Recruiting Resources,2018-09-28,OBGYN needed in Florida,0,Healthcare & Nursing Jobs
642,BAS Healthcare,2018-09-28,Daytona Beach - Outpatient By The Beach,0,Healthcare & Nursing Jobs
643,Quest Healthcare Solutions,2018-09-28,Locums Inpatient Neurology Opportunity in Coastal Southeastern Florida.,0,Healthcare & Nursing Jobs
644,"Hayman Daugherty Associates, Inc",2018-09-28,"Psychiatry in Ft. Lauderdale, FL",0,Healthcare & Nursing Jobs
645,Continuum Medical Staffing,2018-09-28,Pediatrics Locums Putnam County Florida,0,Healthcare & Nursing Jobs
647,"DOCTORS CHOICE PLACEMENT SERVICES, INC.",2018-09-28,"New Full-Time Opportunities in Palm Beach & Sarasota, FL areas",0,Healthcare & Nursing Jobs
648,All Star Recruiting,2018-09-28,"IP/OP Neurologist Needed Near Ft. Walton Beach, Florida",0,Healthcare & Nursing Jobs
649,Enterprise Medical Recruiting,2018-09-28,North Miami Beach Outpatient Primary Care Opportunity,0,Healthcare & Nursing Jobs
650,Enterprise Medical Recruiting,2018-09-28,Adding a Primary Care Provider in Fort Walton Beach FL,0,Healthcare & Nursing Jobs
651,NHR,2018-09-28,Hospitalist Need in Coastal Florida near Orlando,0,Healthcare & Nursing Jobs
653,NHR,2018-09-28,OUTPATIENT IM PHYSICIAN NEED IN SW FLORIDA NOW,0,Healthcare & Nursing Jobs
654,NHR,2018-09-28,"House Call / Home Visits Physician Needed in SW, FL Area",0,Healthcare & Nursing Jobs
655,Enterprise Medical Recruiting,2018-09-28,"Internal Medicine Physician, Naples, FL",0,Healthcare & Nursing Jobs
656,NHR,2018-09-28,"Nocturnist Needed near Tampa, FL",0,Healthcare & Nursing Jobs
657,NHR,2018-09-28,Beautiful SW Florida coast- seeks Neurologist- no call,0,Healthcare & Nursing Jobs
658,NHR,2018-09-28,Urologist needed in coastal Florida,0,Healthcare & Nursing Jobs
659,Enterprise Medical Recruiting,2018-09-28,Fort Walton Beach FL Group Adding OBGYN,0,Healthcare & Nursing Jobs
660,Enterprise Medical Recruiting,2018-09-28,Outpatient Neurology position in Winter Haven Florida,0,Healthcare & Nursing Jobs
661,Physician Providers Mgmt. Corp.,2018-09-28,"Internist/Family Med for West Coast, FL Several Locations",0,Healthcare & Nursing Jobs
662,NHR,2018-09-28,"Pediatrics Opportunity in East coast Florida, less than 1 hr. to Orlando (office only)",0,Healthcare & Nursing Jobs
663,Medicus Healthcare Solutions,2018-09-28,Practice Psychiatry in Coastal Florida – Flexible Scheduling Options,0,Healthcare & Nursing Jobs
665,Weatherby Healthcare,2018-09-28,Gastroenterology in FL - Locums: Coverage is Needed from Temporary Gastroenterologist in Florida,0,Healthcare & Nursing Jobs
666,Enterprise Medical Recruiting,2018-09-28,Florida Gulf Coast - Emergency Medicine Opening,0,Healthcare & Nursing Jobs
667,Weatherby Healthcare,2018-09-28,Emergency Medicine in FL - Locums: Job Opportunity for Emergency Medicine Physician in Florida,0,Healthcare & Nursing Jobs
668,Medical Doctor Associates,2018-09-28,May 2018 Urgent Care for Florida Coast,0,Healthcare & Nursing Jobs
669,Physician Services,2018-09-28,"Urologist Miami, Florida",0,Healthcare & Nursing Jobs
670,Source Medical,2018-09-28,Gulf Coast FL / OP Only or Traditional Setting / BC/BE Internal Medicine,0,Healthcare & Nursing Jobs
671,Gammons Group,2018-09-28,Metro North Florida - Urologist Needed - Hospital Employed Group,0,Healthcare & Nursing Jobs
672,Soliant Health,2018-09-28,Florida psychiatrist - full time outpatient positions,0,Healthcare & Nursing Jobs
673,Gammons Group,2018-09-28,Central Florida - Internal Medicine Position - Outpatient Only,0,Healthcare & Nursing Jobs
674,Enterprise Medical Recruiting,2018-09-28,Hospitalist Opening in Sarasota - 40 Miles from Tampa,0,Healthcare & Nursing Jobs
675,Pacific Companies,2018-09-28,Beach Side Gastroenterology in Florida – Locum Tenens Hospital Coverage – NO CALL,0,Healthcare & Nursing Jobs
677,Integrity Healthcare,2018-09-28,Internal Medicine Physician - Outpatient Only - N. Ft. Meyers Great Bonus,0,Healthcare & Nursing Jobs
678,Physician Providers Mgmt. Corp.,2018-09-28,"OBGYN need in Daytona, FL",0,Healthcare & Nursing Jobs
679,Integrity Healthcare,2018-09-28,Private Practice Internal Medicine Physician - South Florida - Weston,0,Healthcare & Nursing Jobs
680,Source Medical,2018-09-28,Traditional Urologist in Northern FL - No Robotics,0,Healthcare & Nursing Jobs
681,NHR,2018-09-28,Small town living but big time compensation 7 on 7 off Hospitalist,0,Healthcare & Nursing Jobs
682,NHR,2018-09-28,PREMIER MSG IN NORTHERN FL SEEK URGENT CARE PHYSICIAN,0,Healthcare & Nursing Jobs
683,Medicus Healthcare Solutions,2018-09-28,Psychiatrist Needed in Northern Florida – No H&P’s,0,Healthcare & Nursing Jobs
684,NHR,2018-09-28,Amazing IM need for coastal outpatient position in SW Florida. ,0,Healthcare & Nursing Jobs
685,NHR,2018-09-28,Coastal Southeast Florida needs IM\'s and FP\'s,0,Healthcare & Nursing Jobs
687,Weatherby Healthcare,2018-09-28,Anesthesiology in FL - Locums: A Florida Facility Needs a Locums Anesthesiology Provider,0,Healthcare & Nursing Jobs
688,Goldfish Medical Staffing,2018-09-28,Florida Outpatient Neurology (12351 LH),0,Healthcare & Nursing Jobs
689,Goldfish Medical Staffing,2018-09-28,Florida Neurohospitalist (12352 LH),0,Healthcare & Nursing Jobs
690,Alliance Recruiting Resources,2018-09-28,Permanent Psychiatrist Opening Florida,0,Healthcare & Nursing Jobs
691,All Star Recruiting,2018-09-28,OBGYN Opportunity on the east coast of Florida,0,Healthcare & Nursing Jobs
692,Enterprise Medical Recruiting,2018-09-28,Outpatient Pediatrics in Ocala FL,0,Healthcare & Nursing Jobs
693,"The Stembridge Agency, LLC",2018-09-28,"Internal Medicine physician needed in St. Lucie, FL (SA197372)",0,Healthcare & Nursing Jobs
694,All Star Recruiting,2018-09-28,Interventional Neurologist needed to lead program launch near the Florida panhandle,0,Healthcare & Nursing Jobs
695,All Star Recruiting,2018-09-28,Great full-time Gastroenterology opportunity in Northern Florida,0,Healthcare & Nursing Jobs
696,All Star Recruiting,2018-09-28,Hospital employed Pulmonary/Critical care physician opportunity in Florida,0,Healthcare & Nursing Jobs
697,"Hayman Daugherty Associates, Inc",2018-09-28,"Internal Medicine Physician Job in Miramar, Florida",0,Healthcare & Nursing Jobs
698,Enterprise Medical Recruiting,2018-09-28,Pembroke Pines - Psychiatry Need,0,Healthcare & Nursing Jobs
699,Gammons Group,2018-09-28,OB GYN Residency Faculty Position - North Florida Metro Location,0,Healthcare & Nursing Jobs
700,NHR,2018-09-28,"Internal Medicine Physician needed near Orlando, FL",0,Healthcare & Nursing Jobs
701,All Star Recruiting,2018-09-28,OB/GYN Physician,0,Healthcare & Nursing Jobs
702,All Star Recruiting,2018-09-28,Full-time Medical Oncologist needed in a great Coastal Florida community,0,Healthcare & Nursing Jobs
703,VISTA Staffing Solutions,2018-09-28,Enjoy the best of Florida and get extra income,0,Healthcare & Nursing Jobs
704,Integrity Healthcare,2018-09-28,General Gastroenterology Opening; Northeast Coastal Florida,0,Healthcare & Nursing Jobs
705,All Star Recruiting,2018-09-28,Urologist needed for part time locums coverage in Florida,0,Healthcare & Nursing Jobs
706,NHR,2018-09-28,"Hospital-based Critical Care/Intensivist Position in coastal Florida close to Orlando, Fl",0,Healthcare & Nursing Jobs
707,All Star Recruiting,2018-09-28,Central Florida 24 hour call pediatric locums need,0,Healthcare & Nursing Jobs
708,NHR,2018-09-28,Coastal Florida needs a Neurologist,0,Healthcare & Nursing Jobs
709,Integrity Healthcare,2018-09-28,Looking For A Physician To Fill AChronic Care Opportunity In Central Florida,0,Healthcare & Nursing Jobs
710,All Star Recruiting,2018-09-28,Primary Care Physician needed in the Treasure Coast,0,Healthcare & Nursing Jobs
711,All Star Recruiting,2018-09-28,Seeking a BE/BC OB/GYN to join a well-established practice about an hour from Disney World in Central Florida,0,Healthcare & Nursing Jobs
712,All Star Recruiting,2018-09-28,Neuro-Interventional Locums Needed On The East Coast of Florida,0,Healthcare & Nursing Jobs
713,All Star Recruiting,2018-09-28,Full-time Gastroenterology opportunity available in Coastal Southwest Florida offering partnership track,0,Healthcare & Nursing Jobs
714,All Star Recruiting,2018-09-28,Psychiatrist needed in Southwestern Florida,0,Healthcare & Nursing Jobs
715,US Army 1st Medical Recruiting Battalion,2018-09-28,Army Reserve Psychiatry,0,Healthcare & Nursing Jobs
716,Integrity Healthcare,2018-09-28,"Internal Medicine Physician- Outpatient Only - St. Cloud, FL",0,Healthcare & Nursing Jobs
717,Brine Group Staffing Solutions,2018-09-28,Adult Psychiatrist needed,0,Healthcare & Nursing Jobs
718,The Medicus Firm,2018-09-28,Sunny Florida Child Psychiatry,0,Healthcare & Nursing Jobs
719,Enterprise Medical Recruiting,2018-09-28,Miami and North Miami - Psychiatry Needs,0,Healthcare & Nursing Jobs
720,All Star Recruiting,2018-09-28,Incredible Internal Medicine Opening in North Central Florida,0,Healthcare & Nursing Jobs
721,The Delta Companies,2018-09-28,Florida Beach Urology Opportunity - Apply Now - 130881,0,Healthcare & Nursing Jobs
722,All Star Recruiting,2018-09-28,Gastroenterologist opportunity Minutes from Ft. Walton Beach ERCP EUS required,0,Healthcare & Nursing Jobs
723,BAS Healthcare,2018-09-28,Florida Coast Family Medicine Faculty Opening,0,Healthcare & Nursing Jobs
724,All Star Recruiting,2018-09-28,Urology Gap Coverage Locums in Florida,0,Healthcare & Nursing Jobs
725,BAS Healthcare,2018-09-28,Outpatient Openings in Tampa FL,0,Healthcare & Nursing Jobs
726,Medical Search International,2018-09-28,Internal Medicine / Primary Care Position,0,Healthcare & Nursing Jobs
727,All Star Recruiting,2018-09-28,Expanding Group Practice Seeking a Neurologist in Central FL Epilepsy Interest a Plus,0,Healthcare & Nursing Jobs
728,Medicus Healthcare Solutions,2018-09-28,Psychiatrist Needed on the Western Coast of Florida,0,Healthcare & Nursing Jobs
729,All Star Recruiting,2018-09-28,OB/GYN Locum Need One Hour From West Palm FL,0,Healthcare & Nursing Jobs
730,All Star Recruiting,2018-09-28,Urology Locums in Florida – Clinic and ER Call Needed,0,Healthcare & Nursing Jobs
731,Continuum Medical Staffing,2018-09-28,OB GYN PHYSICIAN PEMBROKE PINES FLORIDA,0,Healthcare & Nursing Jobs
732,"All HealthCare Staffing, LLC",2018-09-28,FLEXIBILITY - GROWING PRACTICE,0,Healthcare & Nursing Jobs
733,Continuum Medical Staffing,2018-09-28,"Orlando, Florida",0,Healthcare & Nursing Jobs
735,All Star Recruiting,2018-09-28,Pediatric Neurologist is needed in South Florida,0,Healthcare & Nursing Jobs
736,All Star Recruiting,2018-09-28,Gyn only position available near Disney,0,Healthcare & Nursing Jobs
737,NHR,2018-09-28,Southeast Florida - needs a General Surgeon with Minimal invasive fellowship,0,Healthcare & Nursing Jobs
738,MedSource Consultants,2018-09-28,Adult Psychiatrist,0,Healthcare & Nursing Jobs
739,NHR,2018-09-28,"PSYCHIATRY NEED LEDSS THAN AN HOUR TO ORLANDO, FL",0,Healthcare & Nursing Jobs
740,All Star Recruiting,2018-09-28,OBGYN Opportunity just outside of Walt Disney World,0,Healthcare & Nursing Jobs
741,All Star Recruiting,2018-09-28,Pediatrician opportunity in the South Florida market,0,Healthcare & Nursing Jobs
742,Brine Group Staffing Solutions,2018-09-28,General or Child & Adolescent Psychiatrist needed - Medical Director - New Facility,0,Healthcare & Nursing Jobs
743,"Born & Bicknell, Inc.",2018-09-28,Internal Medicine/Urgent Care Physician Job in Central Florida,0,Healthcare & Nursing Jobs
744,Integrity Healthcare,2018-09-28,Per Diem - Internal Medicine Physician in South Florida - Broward,0,Healthcare & Nursing Jobs
745,"Born & Bicknell, Inc.",2018-09-28,Internal MedicineHIV job in South Florida,0,Healthcare & Nursing Jobs
746,All Star Recruiting,2018-09-28,Outpatient Internal Medicine Physician opportunity in the Florida Panhandle,0,Healthcare & Nursing Jobs
747,BAS Healthcare,2018-09-28,Lucrative Outpatient in Jacksonville FL,0,Healthcare & Nursing Jobs
748,BAS Healthcare,2018-09-28,Orlando Outpatient Opening,0,Healthcare & Nursing Jobs
749,BAS Healthcare,2018-09-28,Neuro Hospitalist Position in Florida,0,Healthcare & Nursing Jobs
750,All Star Recruiting,2018-09-28,Urologist,0,Healthcare & Nursing Jobs
751,Medicus Healthcare Solutions,2018-09-28,Adult Psychiatrist Needed in the Florida Panhandle – Market Competitive Compensation,0,Healthcare & Nursing Jobs
752,Medicus Healthcare Solutions,2018-09-28,Inpatient Psychiatry Coverage Available in Central Florida,0,Healthcare & Nursing Jobs
753,"Med Career Center, Inc",2018-09-28,Panhandle Urgent Care,0,Healthcare & Nursing Jobs
754,All Star Recruiting,2018-09-28,Med/Ped wanted on the West Coast of Florida,0,Healthcare & Nursing Jobs
755,BAS Healthcare,2018-09-28,7on/7off Psychiatry Opportunity in Florida,0,Healthcare & Nursing Jobs
756,All Star Recruiting,2018-09-28,Pediatric Position,0,Healthcare & Nursing Jobs
758,myMDCareers,2018-09-28,Outpatient Physician,0,Healthcare & Nursing Jobs
759,All Star Recruiting,2018-09-28,Locums - Urologist needed for 1 week a month of call,0,Healthcare & Nursing Jobs
760,BAS Healthcare,2018-09-28,Neurology opening near Gulf Coast of Florida,0,Healthcare & Nursing Jobs
