,company,created_date,title,salary,sector
305,"DOCTORS CHOICE PLACEMENT SERVICES, INC.",2018-09-28,New: Neurology Opportunity - East Coast Florida,0,Healthcare & Nursing Jobs
306,"DOCTORS CHOICE PLACEMENT SERVICES, INC.",2018-09-28,Gastroenterology Opportunity - East Coast Florida,0,Healthcare & Nursing Jobs
307,National Health Partners,2018-09-28,Neurology Position in Southwest Florida,0,Healthcare & Nursing Jobs
308,National Health Partners,2018-09-28,"Primary Care opportunity in Ft. Lauderdale, Florida",0,Healthcare & Nursing Jobs
309,Enterprise Medical Recruiting,2018-09-28,"Urologist for city between Panama City Beach and Tallahassee, $400k",0,Healthcare & Nursing Jobs
310,National Health Partners,2018-09-28,Coastal Southwest Florida,0,Healthcare & Nursing Jobs
311,Continuum Medical Staffing,2018-09-28,Neurologist- Florida West Coast,0,Healthcare & Nursing Jobs
312,Goldfish Medical Staffing,2018-09-28,OBGYN Opportunity in Florida (5864 PH),0,Healthcare & Nursing Jobs
313,"Hayman Daugherty Associates, Inc",2018-09-28,Lucrative Neurology Practice in Florida,0,Healthcare & Nursing Jobs
314,National Health Partners,2018-09-28,Florida West Coast: Internal Medicine Hospitalist opportunity,0,Healthcare & Nursing Jobs
315,National Health Partners,2018-09-28,"Internal Medicine Hospitalist opportunity in Miami-Dade County, Florida",0,Healthcare & Nursing Jobs
316,"DOCTORS CHOICE PLACEMENT SERVICES, INC.",2018-09-28,Medical Director Opportunity - Medicare Risk Adjustment HCC Review - Puerto Rico (Option to be Florida Based),0,Healthcare & Nursing Jobs
317,Weatherby Healthcare,2018-09-28,Gastroenterology in FL - Locums: Gastroenterologist Needed in Florida or Locum Tenens Coverage,0,Healthcare & Nursing Jobs
318,"Hayman Daugherty Associates, Inc",2018-09-28,Eastern Coastal Florida Gastroenterology,0,Healthcare & Nursing Jobs
319,"DOCTORS CHOICE PLACEMENT SERVICES, INC.",2018-09-28,New: Primary Care Opportunities here in Metro Southeast Florida,0,Healthcare & Nursing Jobs
320,National Health Partners,2018-09-28,South Florida seeking Nocturnist,0,Healthcare & Nursing Jobs
321,"Hayman Daugherty Associates, Inc",2018-09-28,Gastro Needed Coastal Metro Florida,0,Healthcare & Nursing Jobs
322,NHR,2018-09-28,Join a Stellar Naples Private Practice,0,Healthcare & Nursing Jobs
323,FCSpsy,2018-09-28,Two Adult Psychiatrist,0,Healthcare & Nursing Jobs
324,SourceMD,2018-09-28,Hospitalist Opportunity- Coastal FL,0,Healthcare & Nursing Jobs
325,NHR,2018-09-28,Coastal SW Florida in need of a high OB/GYN- (75% high risk OB and 25% GYN) Strong income potential,0,Healthcare & Nursing Jobs
326,KPS Physician Staffing,2018-09-28,"Gulf Coast Internal Medicine Partnership near Tampa, FL",0,Healthcare & Nursing Jobs
327,Physician Providers Mgmt. Corp.,2018-09-28,OBGYN opportunity in Florida,0,Healthcare & Nursing Jobs
328,SourceMD,2018-09-28,Internal Medicine Opportunity- East Coast FL,0,Healthcare & Nursing Jobs
329,SourceMD,2018-09-28,Pediatric Opportunity- Coastal Florida,0,Healthcare & Nursing Jobs
330,SourceMD,2018-09-28,Gastroenterology Opportunity- Southeast FL,0,Healthcare & Nursing Jobs
331,NHR,2018-09-28,Coastal SW Florida in need of a OB/GYN- Strong income potential,0,Healthcare & Nursing Jobs
332,Integrity Healthcare,2018-09-28,Haitian Creole-Speaking Internal Medicine - Florida Treasure Coast (Ft. Pierce),0,Healthcare & Nursing Jobs
334,National Health Partners,2018-09-28,"Brand New Hospitalist Needs – Orlando, Florida",0,Healthcare & Nursing Jobs
335,Continuum Medical Staffing,2018-09-28,Physician opportunity,0,Healthcare & Nursing Jobs
336,"Hayman Daugherty Associates, Inc",2018-09-28,Florida Neurology Opening with highly successful Multispecialty group,0,Healthcare & Nursing Jobs
337,Continuum Medical Staffing,2018-09-28,Psychiatrist,0,Healthcare & Nursing Jobs
338,Continuum Medical Staffing,2018-09-28,Internal Medicine- South East Florida,0,Healthcare & Nursing Jobs
339,"Necnic Group, LLC",2018-09-28,Urology Need in Florida,0,Healthcare & Nursing Jobs
340,Enterprise Medical Recruiting,2018-09-28,"Tampa, FL Outpatient Primary Care Position",0,Healthcare & Nursing Jobs
341,"DOCTORS CHOICE PLACEMENT SERVICES, INC.",2018-09-28,"Neurology - Join Established Practice In St. Petersburg, Florida",0,Healthcare & Nursing Jobs
342,KPS Physician Staffing,2018-09-28,Brand New ED Seeking Physician in Florida,0,Healthcare & Nursing Jobs
343,"DOCTORS CHOICE PLACEMENT SERVICES, INC.",2018-09-28,GI Opportunity - Florida Panhandle/Great Beach Location,0,Healthcare & Nursing Jobs
344,National Health Partners,2018-09-28,Treasure Coast Needs for Gastroenterologists,0,Healthcare & Nursing Jobs
345,Enterprise Medical Recruiting,2018-09-28,"Adding an Internist near Miami, Florida",0,Healthcare & Nursing Jobs
346,JenCare Senior Medical Centers,2018-09-28,Outpatient Internal Medicine Opportunity in Miami FL,0,Healthcare & Nursing Jobs
347,"The Stembridge Agency, LLC",2018-09-28,"Neurologist needed in St. Petersburg, FL (SA197364)",0,Healthcare & Nursing Jobs
348,Physician Services,2018-09-28,OBG Daytona Florida,0,Healthcare & Nursing Jobs
349,"Hayman Daugherty Associates, Inc",2018-09-28,Multiple locations in Florida seeking locums and permanent EM trained physicians.,0,Healthcare & Nursing Jobs
350,"Hayman Daugherty Associates, Inc",2018-09-28,Outpatient psychiatry practice near Orlando,0,Healthcare & Nursing Jobs
351,"DOCTORS CHOICE PLACEMENT SERVICES, INC.",2018-09-28,"Gastroenterology Practice Opportunity in St. Petersburg, FL",0,Healthcare & Nursing Jobs
352,"Hayman Daugherty Associates, Inc",2018-09-28,Busy trauma center in coastal Florida need additional locums coverage,0,Healthcare & Nursing Jobs
353,"DOCTORS CHOICE PLACEMENT SERVICES, INC.",2018-09-28,"Primary Care (Outpatient) Opportunities in Metro Ft. Lauderdale, FL",0,Healthcare & Nursing Jobs
354,"Hayman Daugherty Associates, Inc",2018-09-28,Child Psych Practice in Florida,0,Healthcare & Nursing Jobs
356,"Necnic Group, LLC",2018-09-28,Neurology Opportunity in Florida,0,Healthcare & Nursing Jobs
357,"Priority Physicians, Inc.",2018-09-28,100% Outpt IM in Florida,0,Healthcare & Nursing Jobs
358,Physician Providers Mgmt. Corp.,2018-09-28,"Gastroenterology opportunity Near Melbourne, FL.",0,Healthcare & Nursing Jobs
359,NHR,2018-09-28,House Call Physician Needed in Southwest Florida,0,Healthcare & Nursing Jobs
360,"DOCTORS CHOICE PLACEMENT SERVICES, INC.",2018-09-28,"OB/GYN Faculty Position In St. Petersburg, Florida",0,Healthcare & Nursing Jobs
361,Continuum Medical Staffing,2018-09-28,Internal Medicine Rockledge FL,0,Healthcare & Nursing Jobs
362,National Health Partners,2018-09-28,Florida Psychiatric Opportunity in a Beautiful Coastal town,0,Healthcare & Nursing Jobs
363,National Health Partners,2018-09-28,Primary Care Physicians needed in South Florida,0,Healthcare & Nursing Jobs
364,"DOCTORS CHOICE PLACEMENT SERVICES, INC.",2018-09-28,Outpatient Primary Care Opportunities - Panhandle of Florida (near the Emerald Coast Beaches),0,Healthcare & Nursing Jobs
365,NHR,2018-09-28,Urgent Care Physicians Needed in Coastal SW Florida,0,Healthcare & Nursing Jobs
367,National Health Partners,2018-09-28,Southwest Florida Hospitalist Opportunity,0,Healthcare & Nursing Jobs
368,Gammons Group,2018-09-28,Metro North Florida - General Psychiatrist Needed - Hospital Employed,0,Healthcare & Nursing Jobs
369,Continuum Medical Staffing,2018-09-28,Psychiatrist Bilingual Miami FL,0,Healthcare & Nursing Jobs
371,National Health Partners,2018-09-28,South Florida seeking Primary Care Physicians,0,Healthcare & Nursing Jobs
372,Enterprise Medical Recruiting,2018-09-28,"Geriatric need in Miami, FL",0,Healthcare & Nursing Jobs
373,"DOCTORS CHOICE PLACEMENT SERVICES, INC.",2018-09-28,OB/GYN Physician Needed in North/Central Florida (Between Jacksonville & Orlando),0,Healthcare & Nursing Jobs
374,FCSpsy,2018-09-28,Adult Psychiatrist,0,Healthcare & Nursing Jobs
375,All Star Recruiting,2018-09-28,Urologist Needed For Employed Opportunity On Treasure Coast of South Florida,0,Healthcare & Nursing Jobs
377,"DOCTORS CHOICE PLACEMENT SERVICES, INC.",2018-09-28,"West Coast Florida Opportunities - St. Petersburg, Tarpon Springs, Bradenton",0,Healthcare & Nursing Jobs
378,Integrity Healthcare,2018-09-28,Internal Medicine Physician needed in Florida Panhandle Community,0,Healthcare & Nursing Jobs
379,"DOCTORS CHOICE PLACEMENT SERVICES, INC.",2018-09-28,Ob/Gyn Needed On Gulf Coast Of Florida - Metro St. Petersburg,0,Healthcare & Nursing Jobs
380,Continuum Medical Staffing,2018-09-28,OB GYN Locums Putnam Couty Florida,0,Healthcare & Nursing Jobs
381,Alpha Medical Group,2018-09-28,Multi-specialty group seeks a Neurologist to join the practice.,0,Healthcare & Nursing Jobs
382,Healthcare Recruitment Counselors,2018-09-28,Physician MD/DO Tallahassee Florida,0,Healthcare & Nursing Jobs
383,Integrity Locums,2018-09-28,Florida Emergency Medicine Physician Locums Opening,0,Healthcare & Nursing Jobs
384,Enterprise Medical Recruiting,2018-09-28,"Fort Myers, Florida Outpatient",0,Healthcare & Nursing Jobs
385,"DOCTORS CHOICE PLACEMENT SERVICES, INC.",2018-09-28,OB/GYN Opportunity in Southwest Florida,0,Healthcare & Nursing Jobs
386,Integrity Healthcare,2018-09-28,Gastroenterology Opening; Northeast Florida,0,Healthcare & Nursing Jobs
387,Healthcare Recruitment Counselors,2018-09-28,Pain Physicians Ft Myers Florida,0,Healthcare & Nursing Jobs
388,NHR,2018-09-28,Coastal SW Florida needs a Neurologist as a Medical Director,0,Healthcare & Nursing Jobs
389,NHR,2018-09-28,Looking for Ob/Gyn in SW Florida,0,Healthcare & Nursing Jobs
390,Continuum Medical Staffing,2018-09-28,Hospitalist Fort Pierce Florida,0,Healthcare & Nursing Jobs
391,NHR,2018-09-28,Ob/Gyn Need in Southwest Florida,0,Healthcare & Nursing Jobs
392,"DOCTORS CHOICE PLACEMENT SERVICES, INC.",2018-09-28,North Florida Primary Care Opportunity,0,Healthcare & Nursing Jobs
393,Physician Providers Mgmt. Corp.,2018-09-28,Neurologist and Neuro-Hospitalist wanted in 3 different locations in FL.,0,Healthcare & Nursing Jobs
394,"Hayman Daugherty Associates, Inc",2018-09-28,Outpatient psychiatry in Florida,0,Healthcare & Nursing Jobs
395,Enterprise Medical Recruiting,2018-09-28,Psychiatry - Addiction and Interventional Medical Pain Management,0,Healthcare & Nursing Jobs
396,Enterprise Medical Recruiting,2018-09-28,"Geriatric need in Ormond Beach, FL",0,Healthcare & Nursing Jobs
397,Source Medical,2018-09-28,GI Opening with Flexible Setup in Coastal Florida,0,Healthcare & Nursing Jobs
398,National Health Partners,2018-09-28,Southwest Florida Seeking Internal Medicine Physician,0,Healthcare & Nursing Jobs
399,Medical Search International,2018-09-28,Hospitalist,0,Healthcare & Nursing Jobs
400,"DOCTORS CHOICE PLACEMENT SERVICES, INC.",2018-09-28,OB/GYN needed in the Panhandle of FL,0,Healthcare & Nursing Jobs
401,National Health Partners,2018-09-28,Hospitalist opportunity in Southern Georgia: 30 minutes from Tallahassee,0,Healthcare & Nursing Jobs
402,"The Stembridge Agency, LLC",2018-09-28,"Psychiatric Residency Program Director needed in Aventura, FL, just north of Miami.",0,Healthcare & Nursing Jobs
403,Continuum Medical Staffing,2018-09-28,Hospitalist,0,Healthcare & Nursing Jobs
404,Physician Providers Mgmt. Corp.,2018-09-28,"Gastroenterology position available in St. Petersburg, FL.",0,Healthcare & Nursing Jobs
405,"DOCTORS CHOICE PLACEMENT SERVICES, INC.",2018-09-28,Hospitalist Opportunities (2) in Metro Southwest Florida,0,Healthcare & Nursing Jobs
406,"DOCTORS CHOICE PLACEMENT SERVICES, INC.",2018-09-28,Neurology Opportunity – East/Central Coast of Florida,0,Healthcare & Nursing Jobs
407,Continuum Medical Staffing,2018-09-28,Gastroenterology- Atlanta,0,Healthcare & Nursing Jobs
408,NHR,2018-09-28,Coastal SW Florida in need of a high risk OB/GYN- (75% high risk OB and 25% GYN) Strong income potential,0,Healthcare & Nursing Jobs
409,Continuum Medical Staffing,2018-09-28,Internal Medicine- one hour from Orlando,0,Healthcare & Nursing Jobs
410,Enterprise Medical Recruiting,2018-09-28,"Immediate URGENT CARE needs in Orlando and Port St. Lucie, FL",0,Healthcare & Nursing Jobs
411,Physician Providers Mgmt. Corp.,2018-09-28,Physician (IM) and ARNP positions available on the East Coast of FL.,0,Healthcare & Nursing Jobs
412,NHR,2018-09-28,Southwest Florida Ob/Gyn Need,0,Healthcare & Nursing Jobs
414,Continuum Medical Staffing,2018-09-28,Neurologist- St. Cloud Florida,0,Healthcare & Nursing Jobs
415,Continuum Medical Staffing,2018-09-28,Gastroenterologist West Palm Beach FL,0,Healthcare & Nursing Jobs
416,NHR,2018-09-28,OB/GYN (high risk) need in Coastal SW Florida- 70 degrees and sunny all Winter - Strong income potential,0,Healthcare & Nursing Jobs
417,Continuum Medical Staffing,2018-09-28,Hospitalist Sarasota Florida,0,Healthcare & Nursing Jobs
418,"The Stembridge Agency, LLC",2018-09-28,"Gastroenterologist needed in Port St. Lucie, FL",0,Healthcare & Nursing Jobs
419,National Health Partners,2018-09-28,Florida Keys Primary Care Opening,0,Healthcare & Nursing Jobs
420,Source Medical,2018-09-28,Neurology,0,Healthcare & Nursing Jobs
421,Enterprise Medical Recruiting,2018-09-28,GI opening in Orlando Florida,0,Healthcare & Nursing Jobs
422,"The Stembridge Agency, LLC",2018-09-28,Psychiatry Residency Program Director needed near Miami.,0,Healthcare & Nursing Jobs
423,Healthcare Recruitment Counselors,2018-09-28,Daytona Florida Family/internal medicine Physician,0,Healthcare & Nursing Jobs
424,NHR,2018-09-28,Fantastic position on SW coast of Florida - Wound Care physician needed,0,Healthcare & Nursing Jobs
425,Continuum Medical Staffing,2018-09-28,Hospitalist Daytona Beach FL,0,Healthcare & Nursing Jobs
426,NHR,2018-09-28,Coastal SW Florida - New Neuroscience Department- Director of Neurology and Staff Physicians needed.,0,Healthcare & Nursing Jobs
427,RCM Health Care Services,2018-09-28,Suburban Florida Hospitalist,0,Healthcare & Nursing Jobs
428,"DOCTORS CHOICE PLACEMENT SERVICES, INC.",2018-09-28,General & Child Psychiatrists Needed - East Coast Florida,0,Healthcare & Nursing Jobs
429,NHR,2018-09-28,Ob/Gyn group is looking to add an experienced physician to its practice,0,Healthcare & Nursing Jobs
430,Enterprise Medical Recruiting,2018-09-28,"Gainesville, Florida - Inpatient Psychiatry",0,Healthcare & Nursing Jobs
431,NHR,2018-09-28,"Internal Medicine Physician needed near Orlando, FL ( Outpatient only )",0,Healthcare & Nursing Jobs
432,"DOCTORS CHOICE PLACEMENT SERVICES, INC.",2018-09-28,"Pediatrics Opportunities in Metro Florida Locations (Tampa, Miami, Ft. Lauderdale, Palm Beach, Jacksonville )",0,Healthcare & Nursing Jobs
433,Gammons Group,2018-09-28,Internal Medicine Position - N. Florida Metro - Join large MultiSpecialty Group,0,Healthcare & Nursing Jobs
434,National Health Partners,2018-09-28,South Florida seeking Neuro - Hospitalist,0,Healthcare & Nursing Jobs
435,Integrity Healthcare,2018-09-28,Internal Medicine Physician in Coastal Florida Panhandle,0,Healthcare & Nursing Jobs
436,"Hayman Daugherty Associates, Inc",2018-09-28,"New OBGYN position in Jacksonville, FL - Very upscale practice needing additional OBGYN",0,Healthcare & Nursing Jobs
437,National Health Partners,2018-09-28,"Medical Director needed for Ft Lauderdale, FL",0,Healthcare & Nursing Jobs
438,Enterprise Medical Recruiting,2018-09-28,"Miami, Florida Outpatient Psychiatry with No Call",0,Healthcare & Nursing Jobs
439,Source Medical,2018-09-28,GYN in Florida - 2 Options Available,0,Healthcare & Nursing Jobs
440,Universal Health Services,2018-09-28,Internal Medicine - Gulf Coast of Florida,0,Healthcare & Nursing Jobs
441,"DOCTORS CHOICE PLACEMENT SERVICES, INC.",2018-09-28,New: Outpatient Primary Care Opportunities in the Florida Panhandle - Great Beach location,0,Healthcare & Nursing Jobs
442,RCM Health Care Services,2018-09-28,Florida Emergency Medicine Physician,0,Healthcare & Nursing Jobs
443,Integrity Locums,2018-09-28,"Locums Nocturnist Position in Daytona, Florida area",0,Healthcare & Nursing Jobs
444,National Health Partners,2018-09-28,Urgent Care opening in Southwest Florida,0,Healthcare & Nursing Jobs
445,"DOCTORS CHOICE PLACEMENT SERVICES, INC.",2018-09-28,Psychiatrist Needed In Southwest Florida,0,Healthcare & Nursing Jobs
446,Enterprise Medical Recruiting,2018-09-28,Emergency Medicine Physician South of Gainesville,0,Healthcare & Nursing Jobs
447,Source Medical,2018-09-28,"Psychiatry Opening in Coastal Florida, signing bonus and incentives",0,Healthcare & Nursing Jobs
448,National Health Partners,2018-09-28,Florida Keys Hospitalist Opportunity,0,Healthcare & Nursing Jobs
449,Enterprise Medical Recruiting,2018-09-28,"Outpatient Pediatric Opening in Tallahassee, FL",0,Healthcare & Nursing Jobs
450,Physician Providers Mgmt. Corp.,2018-09-28,Gastroenterology opportunity in FL,0,Healthcare & Nursing Jobs
451,Enterprise Medical Recruiting,2018-09-28,Group Neurology position in West Palm Beach FL,0,Healthcare & Nursing Jobs
452,Enterprise Medical Recruiting,2018-09-28,Adding an Urologist in Panhandle community of Florida,0,Healthcare & Nursing Jobs
453,NHR,2018-09-28,"Urology Physician needed near Tampa, FL",0,Healthcare & Nursing Jobs
454,"Consilium Staffing, LLC",2018-09-28,"Hiring Locum Tenens Anesthesiologist, Full-Time—Florida",0,Healthcare & Nursing Jobs
455,All Star Recruiting,2018-09-28,Urologist needed for ongoing call coverage,0,Healthcare & Nursing Jobs
456,Integrity Healthcare,2018-09-28,Outpatient Pediatric Opening - Florida Atlantic Coast - Port St Lucie,0,Healthcare & Nursing Jobs
457,Pacific Companies,2018-09-28,Coastal Florida Neurohospitalist,0,Healthcare & Nursing Jobs
458,Enterprise Medical Recruiting,2018-09-28,"Live and Work in Beautiful Ocala, FL - Child and Adult Positions Available",0,Healthcare & Nursing Jobs
459,National Health Partners,2018-09-28,SEEKING MEDICAL DIRECTOR FOR ACUTE CARE FACILITIES: EAST COAST OF FLORIDA:,0,Healthcare & Nursing Jobs
460,"Teladoc Physicians, P.A.",2018-09-28,Supplement Your Income - TELEMEDICINE,0,Healthcare & Nursing Jobs
461,All Star Recruiting,2018-09-28,Excellent Internal Medicine Opportunity in North Central Florida,0,Healthcare & Nursing Jobs
462,"DOCTORS CHOICE PLACEMENT SERVICES, INC.",2018-09-28,East Coast Florida GI Opportunity,0,Healthcare & Nursing Jobs
463,All Star Recruiting,2018-09-28,Nocturnist needed in Beautiful Coastal Florida / 290k,0,Healthcare & Nursing Jobs
464,NHR,2018-09-28,"Coastal Sunny SW Florida - New Neuroscience Department- Staff Physicians needed.(Outpatient only, inpatient only or a combina",0,Healthcare & Nursing Jobs
465,TeamHealth,2018-09-28,Anesthesiologist,0,Healthcare & Nursing Jobs
466,All Star Recruiting,2018-09-28,Urology Call Coverage in FL -Urgent Locums Need,0,Healthcare & Nursing Jobs
467,LocumTenens.com,2018-09-28,Part-time Locum Tenens Psychiatrist Needed in Florida,0,Healthcare & Nursing Jobs
468,Enterprise Medical Recruiting,2018-09-28,"Internal medicine needs in Clewiston and LaBelle, FL",0,Healthcare & Nursing Jobs
469,Enterprise Medical Recruiting,2018-09-28,South Florida-Research Psychiatrist to Serve as Associate Medical Director,0,Healthcare & Nursing Jobs
470,Goldfish Medical Staffing,2018-09-28,Coastal Florida Hospitalist Opportunity (9537 LM),0,Healthcare & Nursing Jobs
471,"DOCTORS CHOICE PLACEMENT SERVICES, INC.",2018-09-28,OB/GYN Position On Florida Gulf Coast - Robot Available,0,Healthcare & Nursing Jobs
472,NHR,2018-09-28,"SW Coastal FL needs Gastroenterology Physicians, over $500K",0,Healthcare & Nursing Jobs
473,Enterprise Medical Recruiting,2018-09-28,Outstanding Salary Guarantee and Sign-on Bonus,0,Healthcare & Nursing Jobs
474,"MD Staff Pointe, LLC",2018-09-28,Permanent Internal Medicine Opportunity in Florida,0,Healthcare & Nursing Jobs
475,Integrity Healthcare,2018-09-28,Internal Medicine Physician - Outpatient Only - Central Florida Great Bonus,0,Healthcare & Nursing Jobs
476,All Star Recruiting,2018-09-28,Excellent Internal Medicine/Geriatric Medicine opportunity in on the Gulf Coast of Florida,0,Healthcare & Nursing Jobs
477,All Star Recruiting,2018-09-28,Outpatient or Traditional Internal Medicine Opening in the Florida Panhandle,0,Healthcare & Nursing Jobs
479,Enterprise Medical Recruiting,2018-09-28,Primary Care Practice on Beautiful Gulf Coast,0,Healthcare & Nursing Jobs
480,"DOCTORS CHOICE PLACEMENT SERVICES, INC.",2018-09-28,NeuroHospitalist Opportunity in Northern Florida - College Town,0,Healthcare & Nursing Jobs
481,All Star Recruiting,2018-09-28,Treasure coast Florida 24 hour call coverage Monday and Wednesdays,0,Healthcare & Nursing Jobs
482,Gammons Group,2018-09-28,North Metro Florida -Join Exceptional Neuro Practice,0,Healthcare & Nursing Jobs
483,"DOCTORS CHOICE PLACEMENT SERVICES, INC.",2018-09-28,Anesthesia Opportunity East Coast Central Florida,0,Healthcare & Nursing Jobs
484,Continuum Medical Staffing,2018-09-28,OB GYN Near Fort Lauderdale Florida,0,Healthcare & Nursing Jobs
485,Physician Providers Mgmt. Corp.,2018-09-28,"OB/GYN position available in West-Central, FL",0,Healthcare & Nursing Jobs
486,Enterprise Medical Recruiting,2018-09-28,"Inpatient or Outpatient Positions Available in Panama City, FL",0,Healthcare & Nursing Jobs
487,All Star Recruiting,2018-09-28,OBGYN Opening in Beautiful City on the West Coast of Florida,0,Healthcare & Nursing Jobs
488,Medical Search International,2018-09-28,Internal Medicine Provider Needed,0,Healthcare & Nursing Jobs
489,All Star Recruiting,2018-09-28,OB/GYN Weekend Call Locums in Florida,0,Healthcare & Nursing Jobs
490,Enterprise Medical Recruiting,2018-09-28,"Two Urologists to Join MSG Practice, Coastal FL Dream",0,Healthcare & Nursing Jobs
491,Continuum Medical Staffing,2018-09-28,GI,0,Healthcare & Nursing Jobs
492,Integrity Healthcare,2018-09-28,Urologist needed - Port St. Lucie,0,Healthcare & Nursing Jobs
493,Integrity Healthcare,2018-09-28,"Outpatient Internal Medicine Physician Role in St. Lucie West, Florida",0,Healthcare & Nursing Jobs
494,NHR,2018-09-28,"Psychiatry Medical Director needed near Orlando, FL",0,Healthcare & Nursing Jobs
495,Enterprise Medical Recruiting,2018-09-28,"Partnership track GI position, with Ancillaries, in Orlando",0,Healthcare & Nursing Jobs
496,"Consilium Staffing, LLC",2018-09-28,"Hiring Locum Tenens Psychiatrist, Full-Time No Call—Florida",0,Healthcare & Nursing Jobs
497,"Hayman Daugherty Associates, Inc",2018-09-28,Psychiatry Residency Program Director,0,Healthcare & Nursing Jobs
498,"Hayman Daugherty Associates, Inc",2018-09-28,Gastroenterologist,0,Healthcare & Nursing Jobs
499,"DOCTORS CHOICE PLACEMENT SERVICES, INC.",2018-09-28,"New: Hospitalist Opportunity in the Metro Ft. Lauderdale, FL area",0,Healthcare & Nursing Jobs
500,All Star Recruiting,2018-09-28,Internal Medicine Opportunity in Western Central Florida,0,Healthcare & Nursing Jobs
501,All Star Recruiting,2018-09-28,Inpatient Neurologist needed in North West Florida,0,Healthcare & Nursing Jobs
502,All Star Recruiting,2018-09-28,Panhandle Florida area long weekend practice call needed,0,Healthcare & Nursing Jobs
503,BAS Healthcare,2018-09-28,Outpatient Openings in Orlando FL,0,Healthcare & Nursing Jobs
504,Enterprise Medical Recruiting,2018-09-28,7 on/7 off Psychiatry in a Community Where You Can Work and Play,0,Healthcare & Nursing Jobs
505,Continuum Medical Staffing,2018-09-28,Gastroenterology Ft Myers Florida,0,Healthcare & Nursing Jobs
507,BAS Healthcare,2018-09-28,$200 000 in Coastal Tampa Suburbs,0,Healthcare & Nursing Jobs
508,"MD Staff Pointe, LLC",2018-09-28,Unique Hospitalist Opportunity in Florida,0,Healthcare & Nursing Jobs
510,All Star Recruiting,2018-09-28,Outpatient hospital employed Gastroenterology position available in coastal southwest Florida,0,Healthcare & Nursing Jobs
511,"DOCTORS CHOICE PLACEMENT SERVICES, INC.",2018-09-28,GI position in central east coast Florida,0,Healthcare & Nursing Jobs
512,TeamHealth,2018-09-28,EM Physician,0,Healthcare & Nursing Jobs
513,All Star Recruiting,2018-09-28,Urology ER Call Locums in FL,0,Healthcare & Nursing Jobs
514,NHR,2018-09-28,East Coast Florida Ob/Gyn Need,0,Healthcare & Nursing Jobs
515,Enterprise Medical Recruiting,2018-09-28,"General Neurology position in Fort Myers, FL",0,Healthcare & Nursing Jobs
516,All Star Recruiting,2018-09-28,Nocturnist needed in Beautiful Coastal Florida 30 min from Daytona,0,Healthcare & Nursing Jobs
517,Enterprise Medical Recruiting,2018-09-28,Florida's Emerald Coast seeking GI physician,0,Healthcare & Nursing Jobs
518,Enterprise Medical Recruiting,2018-09-28,"Urgent Care need in Palm Harbor, FL",0,Healthcare & Nursing Jobs
520,"Consilium Staffing, LLC",2018-09-28,"Hiring Locum Tenens Pediatrician, Vacation Coverage—Florida",0,Healthcare & Nursing Jobs
521,All Star Recruiting,2018-09-28,Urology ER Call Locums in FL (weekends/weekdays),0,Healthcare & Nursing Jobs
522,All Star Recruiting,2018-09-28,Urologist Opening in The Treasure Coast Area of Florida,0,Healthcare & Nursing Jobs
523,Enterprise Medical Recruiting,2018-09-28,"Psychiatry Position Now Available Tallahassee, FL",0,Healthcare & Nursing Jobs
524,"DOCTORS CHOICE PLACEMENT SERVICES, INC.",2018-09-28,Nocturnist Opportunities - East Coast of Florida,0,Healthcare & Nursing Jobs
525,Enterprise Medical Recruiting,2018-09-28,Partnership Track for Established Practice in Central Florida near Orlando,0,Healthcare & Nursing Jobs
526,"Born & Bicknell, Inc.",2018-09-28,Advanced Endoscopist GI Physician Job in South Florida Bilingual Spanish pref,0,Healthcare & Nursing Jobs
527,"Born & Bicknell, Inc.",2018-09-28,Family Medicine/Urgent Care Physician Job in Central Florida,0,Healthcare & Nursing Jobs
529,Continuum Medical Staffing,2018-09-28,Hospitalist IM or FM Tallahassee FL,0,Healthcare & Nursing Jobs
530,Enterprise Medical Recruiting,2018-09-28,"Internal Medicine Position in Sarasota, FL",0,Healthcare & Nursing Jobs
531,"Hayman Daugherty Associates, Inc",2018-09-28,Internal Medicine Physicians Needed in Southwest Florida,0,Healthcare & Nursing Jobs
