,company,created_date,title,salary,sector
0,Taylor Harmon Search Group,2017-12-06,Commercial Lines Account Manager,0,Unknown
1,DELL,2018-03-07,Consultant,0,Graduate Jobs
2,"NBCUniversal, Inc.",2018-03-08,Golfer Care Specialist,0,"PR, Advertising & Marketing Jobs"
3,DELL,2018-03-18,"Federal - Business Development - McLean, VA (Remote: FL)",0,Unknown
4,Cox Media Group,2018-07-24,General Sales Manager,0,"PR, Advertising & Marketing Jobs"
5,Hearst Television,2018-08-09,Sales Account Associate - Entry Level,0,"PR, Advertising & Marketing Jobs"
6,Dell,2018-08-22,DevOps Site Reliability Engineer,0,Engineering Jobs
7,Cox Media Group,2018-08-28,Reporter,0,"PR, Advertising & Marketing Jobs"
8,Hearst Television,2018-08-30,Account Executive,0,"PR, Advertising & Marketing Jobs"
9,"NBCUniversal, Inc.",2018-09-06,Field Producer,0,"PR, Advertising & Marketing Jobs"
10,Boca Raton Regional Hospital,2018-09-07,Medical Technologist - Charge - SIGN ON BONUS,0,Unknown
11,Boca Raton Regional Hospital,2018-09-07,Neuro Physical Therapist - SIGNING BONUS,0,Unknown
12,Hearst Television,2018-09-09,Street Team Ambassador,0,"PR, Advertising & Marketing Jobs"
13,DELL,2018-09-14,Sr Advisor (I8) Service Delivery of Pivotal Cloud Foundry (PCF),0,Graduate Jobs
14,DELL,2018-09-18,"Account Executive 3, Business Development - Sales - Washington, DC, Virginia (Remote)",0,Sales Jobs
15,Cox Media Group,2018-09-23,General Sales Manager,0,"PR, Advertising & Marketing Jobs"
16,"NBCUniversal, Inc.",2018-09-26,"Vice President, Entertainment Publicity",0,"PR, Advertising & Marketing Jobs"
17,National Health Partners,2018-09-28,Jacksonville Florida seeking experienced Hospitalists,0,Healthcare & Nursing Jobs
18,"Hayman Daugherty Associates, Inc",2018-09-28,Emergency Medicine Physician Job Florida,0,Healthcare & Nursing Jobs
19,"Hayman Daugherty Associates, Inc",2018-09-28,ObGyn Physician Job Florida,0,Healthcare & Nursing Jobs
20,SourceMD,2018-09-28,Internal Medicine Opportunity- Near Tampa,0,Healthcare & Nursing Jobs
22,"Hayman Daugherty Associates, Inc",2018-09-28,Earn extra income as a Locums ER physician in Northern Florida.,0,Healthcare & Nursing Jobs
25,"Hayman Daugherty Associates, Inc",2018-09-28,Gastro needed in Palm Beach County,0,Healthcare & Nursing Jobs
28,"Hayman Daugherty Associates, Inc",2018-09-28,Internal Medicine Physician Job Florida,0,Healthcare & Nursing Jobs
29,"Hayman Daugherty Associates, Inc",2018-09-28,Neurology Physician Job Florida,0,Healthcare & Nursing Jobs
34,National Health Partners,2018-09-28,Established Hospitalist group,0,Healthcare & Nursing Jobs
35,National Health Partners,2018-09-28,SEEKING HOSPITALIST (DAYS) FOR WEST COAST OF FL,0,Healthcare & Nursing Jobs
36,National Health Partners,2018-09-28,Hospitalist Opportunity – Coastal Florida,0,Healthcare & Nursing Jobs
37,National Health Partners,2018-09-28,"7 on / 7 off Hospitalist Opportunity One Hour from Orlando, FL",0,Healthcare & Nursing Jobs
38,FCSpsy,2018-09-28,Psychiatrist for Adults,0,Healthcare & Nursing Jobs
39,National Health Partners,2018-09-28,"Fort Myers, Florida",0,Healthcare & Nursing Jobs
40,National Health Partners,2018-09-28,Internal Medicine Practice – South Florida,0,Healthcare & Nursing Jobs
42,SourceMD,2018-09-28,Urology Opportunity- Near Tampa,0,Healthcare & Nursing Jobs
43,National Health Partners,2018-09-28,"Fort Myers, Florida Hospitalist",0,Healthcare & Nursing Jobs
44,"Hayman Daugherty Associates, Inc",2018-09-28,Hospitalist Physician Job Florida,0,Healthcare & Nursing Jobs
46,"Hayman Daugherty Associates, Inc",2018-09-28,Gastroenterology Physician Job Florida,0,Healthcare & Nursing Jobs
51,"Hayman Daugherty Associates, Inc",2018-09-28,EM LOCUMS NEED IN FLORIDA,0,Healthcare & Nursing Jobs
52,"Hayman Daugherty Associates, Inc",2018-09-28,Child Psych practice in Metro area,0,Healthcare & Nursing Jobs
54,"Hayman Daugherty Associates, Inc",2018-09-28,Outpatient Adult Psych Oepning,0,Healthcare & Nursing Jobs
55,"Hayman Daugherty Associates, Inc",2018-09-28,Inpatient Psych Opening in Florida,0,Healthcare & Nursing Jobs
56,National Health Partners,2018-09-28,SEEKING HOSPITALIST FOR THE FLORIDA PANHANDLE,0,Healthcare & Nursing Jobs
57,"Hayman Daugherty Associates, Inc",2018-09-28,New Ob/Gyn Opportunity in North Miami,0,Healthcare & Nursing Jobs
58,National Health Partners,2018-09-28,"Internal Medicine Hospitalist opportunity in Palm Beach County, Florida",0,Healthcare & Nursing Jobs
59,National Health Partners,2018-09-28,"Primary Care Physician needed for South Palm Beach, Florida",0,Healthcare & Nursing Jobs
60,NHR,2018-09-28,"Pediatrician needed near Jacksonville, FL",0,Healthcare & Nursing Jobs
61,SourceMD,2018-09-28,Neurohospitalist Opportunity- Miami area,0,Healthcare & Nursing Jobs
62,SourceMD,2018-09-28,Neurology Opportunity- Coastal FL,0,Healthcare & Nursing Jobs
63,SourceMD,2018-09-28,Hospitalist Opportunity- Near Tampa,0,Healthcare & Nursing Jobs
64,SourceMD,2018-09-28,IM opportunity- Orlando area,0,Healthcare & Nursing Jobs
66,SourceMD,2018-09-28,Psychiatric Hospitalist- Coastal Florida,0,Healthcare & Nursing Jobs
67,SourceMD,2018-09-28,"Hospitalist Opportunity- Miami, Florida area",0,Healthcare & Nursing Jobs
68,NHR,2018-09-28,NeuroHospitalist need near Orlando,0,Healthcare & Nursing Jobs
69,"DOCTORS CHOICE PLACEMENT SERVICES, INC.",2018-09-28,"Urology position between Tampa & Orlando, FL",0,Healthcare & Nursing Jobs
70,"Hayman Daugherty Associates, Inc",2018-09-28,Urgent Care in Coastal Florida,0,Healthcare & Nursing Jobs
71,"DOCTORS CHOICE PLACEMENT SERVICES, INC.",2018-09-28,OB/GYN Opportunity In South Central Florida,0,Healthcare & Nursing Jobs
72,National Health Partners,2018-09-28,OUTPATIENT OPPORTUNITY IN SOUTH FLORIDA,0,Healthcare & Nursing Jobs
73,"Necnic Group, LLC",2018-09-28,Psychiatry Opportunity in Florida,0,Healthcare & Nursing Jobs
74,"Necnic Group, LLC",2018-09-28,Internal Medicine Opportunity in Florida,0,Healthcare & Nursing Jobs
75,"Hayman Daugherty Associates, Inc",2018-09-28,Lucrative Neurology Practice in Northern Florida,0,Healthcare & Nursing Jobs
76,NHR,2018-09-28,"Internal Medicine Physician needed near Jacksonville, FL.",0,Healthcare & Nursing Jobs
77,NHR,2018-09-28,"Neurohospitalist needed in Metro Southeast Florida, in Ft. Lauderdale suburbs.",0,Healthcare & Nursing Jobs
78,NHR,2018-09-28,Pediatrician needed in Central FL,0,Healthcare & Nursing Jobs
79,NHR,2018-09-28,Florida's East Coast needs an Urgent Care physician - 90 hr plus benefits and bonus (Ormond Beach area),0,Healthcare & Nursing Jobs
80,Continuum Medical Staffing,2018-09-28,Psychiatrist Near Vero Beach FL,0,Healthcare & Nursing Jobs
81,NHR,2018-09-28,Urgent Care & OutPatient Family Medicine Opportunity throughout Florida,0,Healthcare & Nursing Jobs
82,NHR,2018-09-28,"Internal Medicine Physician needed near Tampa, FL (Outpatient only)",0,Healthcare & Nursing Jobs
83,"DOCTORS CHOICE PLACEMENT SERVICES, INC.",2018-09-28,"Hospitalist Needed In Metro St. Petersburg, Florida - Great Compensation",0,Healthcare & Nursing Jobs
84,"DOCTORS CHOICE PLACEMENT SERVICES, INC.",2018-09-28,Pediatrics (OUTPATIENT) Position in North Central FL near Gainesville,0,Healthcare & Nursing Jobs
85,National Health Partners,2018-09-28,South Florida seeking Hospitalist,0,Healthcare & Nursing Jobs
86,NHR,2018-09-28,"Gastroenterology Physician needed near Tampa, FL",0,Healthcare & Nursing Jobs
87,"DOCTORS CHOICE PLACEMENT SERVICES, INC.",2018-09-28,"Urology - Live and work near the Emerald Coast Destin, FW Beach area",0,Healthcare & Nursing Jobs
88,TeedCo. Healthcare Recruiting,2018-09-28,Emergency Medicine Community and Academic in Florida,0,Healthcare & Nursing Jobs
89,"DOCTORS CHOICE PLACEMENT SERVICES, INC.",2018-09-28,Urology Opportunity In South Florida,0,Healthcare & Nursing Jobs
90,Integrity Healthcare,2018-09-28,Employed Internal Medicine Position in Central Florida,0,Healthcare & Nursing Jobs
91,National Health Partners,2018-09-28,PRIMARY CARE OPPORTUNITY IN N MIAMI: OUTPATIENT ONLY:,0,Healthcare & Nursing Jobs
92,Medical Search International,2018-09-28,"Permanent Needs- Urgent Care- Vero Beach, Florida",0,Healthcare & Nursing Jobs
93,NHR,2018-09-28,Beautiful SW Coastal Florida - adding hospitalists to the team,0,Healthcare & Nursing Jobs
94,NHR,2018-09-28,Exquisite SW Coastal FL is seeking Primary Care(FP or IM)- physicians who have a heart for underserved and uninsured patients,0,Healthcare & Nursing Jobs
95,"DOCTORS CHOICE PLACEMENT SERVICES, INC.",2018-09-28,Pediatrics Opportunity - Outpatient only - North Florida/University Town,0,Healthcare & Nursing Jobs
96,National Health Partners,2018-09-28,South Florida Urgent Care,0,Healthcare & Nursing Jobs
97,"Hayman Daugherty Associates, Inc",2018-09-28,General GI practice in Eastern Florida,0,Healthcare & Nursing Jobs
98,FCSpsy,2018-09-28,Psychiatrist,0,Healthcare & Nursing Jobs
99,Continuum Medical Staffing,2018-09-28,Neuroogy Rockledge FL,0,Healthcare & Nursing Jobs
100,"DOCTORS CHOICE PLACEMENT SERVICES, INC.",2018-09-28,Southeast Florida OB/GYN Practice Opportunity,0,Healthcare & Nursing Jobs
101,Continuum Medical Staffing,2018-09-28,Internal medicine Out Patient,0,Healthcare & Nursing Jobs
102,"DOCTORS CHOICE PLACEMENT SERVICES, INC.",2018-09-28,Primary Care/Bariatrician Needed to Join Center of Excellence on the East Coast of Florida,0,Healthcare & Nursing Jobs
103,Goldfish Medical Staffing,2018-09-28,Seeking an Internal Medicine physician to join established practice on the Gulf Coast of Florida (5970 PH),0,Healthcare & Nursing Jobs
105,"DOCTORS CHOICE PLACEMENT SERVICES, INC.",2018-09-28,URGENT CARE Physicians Needed - East Coast of Florida/Great Location,0,Healthcare & Nursing Jobs
106,"DOCTORS CHOICE PLACEMENT SERVICES, INC.",2018-09-28,Hospitalist Opportunity - East Coast Florida,0,Healthcare & Nursing Jobs
107,"Necnic Group, LLC",2018-09-28,Neurology Need in Florida,0,Healthcare & Nursing Jobs
109,"DOCTORS CHOICE PLACEMENT SERVICES, INC.",2018-09-28,New Psychiatry (Outpatient) Opportunity in Metro Southeast Florida (Miami/Ft. Lauderdale),0,Healthcare & Nursing Jobs
110,Continuum Medical Staffing,2018-09-28,Hospitalist St Petersburg Florida,0,Healthcare & Nursing Jobs
111,"DOCTORS CHOICE PLACEMENT SERVICES, INC.",2018-09-28,OB/GYN Opportunity in Northern Florida,0,Healthcare & Nursing Jobs
112,Enterprise Medical Recruiting,2018-09-28,Psychiatric Program Director in Orlando,0,Healthcare & Nursing Jobs
113,NHR,2018-09-28,METRO TENNESSEE MOVEMENT AND GENERAL NEUROLOGY OPPORTUNITIES,0,Healthcare & Nursing Jobs
114,Integrity Healthcare,2018-09-28,Outpatient or Traditional Internist Needed on Florida Panhandle Coast,0,Healthcare & Nursing Jobs
115,Continuum Medical Staffing,2018-09-28,Locum Emergency medicine,0,Healthcare & Nursing Jobs
116,Integrity Healthcare,2018-09-28,BE/BC Gastroenterologist Physician Position in Beautiful South Florida,0,Healthcare & Nursing Jobs
117,Healthcare Recruitment Counselors,2018-09-28,Family/Internal medicine or GP Physician Sun City Florida,0,Healthcare & Nursing Jobs
118,NHR,2018-09-28,Ob/Gyn Need for Atlanta Suburb,0,Healthcare & Nursing Jobs
119,Continuum Medical Staffing,2018-09-28,Hospitalist Naples Florida,0,Healthcare & Nursing Jobs
120,Continuum Medical Staffing,2018-09-28,Internal Medicine,0,Healthcare & Nursing Jobs
121,"Priority Physicians, Inc.",2018-09-28,"New Florida Neurology job w/ Epilepsy, Headache, or MS",0,Healthcare & Nursing Jobs
122,FCSpsy,2018-09-28,Psychiatrists,0,Healthcare & Nursing Jobs
123,NHR,2018-09-28,Beautiful SW Coastal Florida needs a Neurologist - 100% Outpatient,0,Healthcare & Nursing Jobs
124,Physician Providers Mgmt. Corp.,2018-09-28,Physician (Adult-Psych) and ARNP positions available on the East Coast of FL.,0,Healthcare & Nursing Jobs
125,National Health Partners,2018-09-28,Southwest Florida Hospitalist opening,0,Healthcare & Nursing Jobs
126,National Health Partners,2018-09-28,Key West Florida seeking Pediatrician,0,Healthcare & Nursing Jobs
127,National Health Partners,2018-09-28,FAMILY PRACTICE and INTERNAL MEDICINE PHYSICIANS NEEDED,0,Healthcare & Nursing Jobs
128,"Priority Physicians, Inc.",2018-09-28,Florida position for Neurologist w/ sub-specialty training,0,Healthcare & Nursing Jobs
129,NHR,2018-09-28,Coastal SW Coastal FL needs Gastroenterology Physicians,0,Healthcare & Nursing Jobs
130,National Health Partners,2018-09-28,"New Hospitalist Opportunities - Jacksonville, Florida",0,Healthcare & Nursing Jobs
131,Medical Search International,2018-09-28,IMMEDIATE NEED: Family Practice and/or Internal Medicine Positions on the Gulf Coast,0,Healthcare & Nursing Jobs
132,National Health Partners,2018-09-28,Coastal Florida seeking Primary Care Physicians,0,Healthcare & Nursing Jobs
133,Enterprise Medical Recruiting,2018-09-28,OB-GYN sought for the West Palm Beach area,0,Healthcare & Nursing Jobs
136,"DOCTORS CHOICE PLACEMENT SERVICES, INC.",2018-09-28,West Coast FL Urology Opportunity,0,Healthcare & Nursing Jobs
137,"DOCTORS CHOICE PLACEMENT SERVICES, INC.",2018-09-28,Internal Medicine (Outpatient) Opportunity in Northern Florida (Near St. Augustine),0,Healthcare & Nursing Jobs
138,Alpha Medical Group,2018-09-28,Outpatient practice with no call responsibilities.,0,Healthcare & Nursing Jobs
142,"DOCTORS CHOICE PLACEMENT SERVICES, INC.",2018-09-28,Outpatient Primary Care Opportunities (4) - Florida Panhandle - Great Location,0,Healthcare & Nursing Jobs
152,"DOCTORS CHOICE PLACEMENT SERVICES, INC.",2018-09-28,GI positions - central east coast Florida,0,Healthcare & Nursing Jobs
153,Enterprise Medical Recruiting,2018-09-28,"Tampa Bay, FL FM/IM Needs",0,Healthcare & Nursing Jobs
154,Goldfish Medical Staffing,2018-09-28,Coastal Florida GI Opportunity (9956 LM),0,Healthcare & Nursing Jobs
155,Continuum Medical Staffing,2018-09-28,Gastroenterologist,0,Healthcare & Nursing Jobs
157,National Health Partners,2018-09-28,"Hospitalist Needed – 35 minutes of Orlando, Florida",0,Healthcare & Nursing Jobs
158,"Hayman Daugherty Associates, Inc",2018-09-28,Coastal Southern Florida Gastroenterology,0,Healthcare & Nursing Jobs
159,"Hayman Daugherty Associates, Inc",2018-09-28,South Florida Gastroenterology Physician,0,Healthcare & Nursing Jobs
160,National Health Partners,2018-09-28,Florida seeking Emergency Medicine Physician,0,Healthcare & Nursing Jobs
161,FCSpsy,2018-09-28,General Psychiatrist,0,Healthcare & Nursing Jobs
162,National Health Partners,2018-09-28,Florida Urgent Care Openings on the Coast,0,Healthcare & Nursing Jobs
163,SourceMD,2018-09-28,OBGYN Opportunity- Coastal FL,0,Healthcare & Nursing Jobs
164,SourceMD,2018-09-28,Gastroenterology Opportunity- Coastal FL,0,Healthcare & Nursing Jobs
165,SourceMD,2018-09-28,"OBGYN Opportunity- Jacksonville, FL area",0,Healthcare & Nursing Jobs
166,"DOCTORS CHOICE PLACEMENT SERVICES, INC.",2018-09-28,Pediatrics Opportunities on Florida's East Coast,0,Healthcare & Nursing Jobs
167,TeedCo. Healthcare Recruiting,2018-09-28,Internal Medicine Close to Tampa and Orlando,0,Healthcare & Nursing Jobs
168,SourceMD,2018-09-28,Neuology Opportunity- Metro area FL,0,Healthcare & Nursing Jobs
170,SourceMD,2018-09-28,Neurology Opportunity- Near Tampa,0,Healthcare & Nursing Jobs
171,SourceMD,2018-09-28,Internal Medicine Opportunity- near Tampa,0,Healthcare & Nursing Jobs
172,SourceMD,2018-09-28,ER opportunity- Florida,0,Healthcare & Nursing Jobs
173,Enterprise Medical Recruiting,2018-09-28,Fantastic Emergency Medicine Physician Opportunity,0,Healthcare & Nursing Jobs
174,Samuel Contract Staffing,2018-09-28,"We need a Physician part time in Miami, FL",0,Healthcare & Nursing Jobs
175,SourceMD,2018-09-28,"IM opportunity- East Coast, FL",0,Healthcare & Nursing Jobs
176,SourceMD,2018-09-28,"Neurology Opportunity- East Coast, FL",0,Healthcare & Nursing Jobs
177,SourceMD,2018-09-28,Hospitalist Opportunity- Coastal Florida,0,Healthcare & Nursing Jobs
178,Samuel Contract Staffing,2018-09-28,Part-Time Medical Director,0,Healthcare & Nursing Jobs
184,Continuum Medical Staffing,2018-09-28,OB GYN Gainesville FL,0,Healthcare & Nursing Jobs
185,Universal Health Services,2018-09-28,Physician - Obstetrics and Gynecology - Gulf Coast FL,0,Healthcare & Nursing Jobs
188,"DOCTORS CHOICE PLACEMENT SERVICES, INC.",2018-09-28,East Coast Florida Group looking for a Neurologist with Musculoskeletal focus,0,Healthcare & Nursing Jobs
198,Enterprise Medical Recruiting,2018-09-28,"Tallahassee, Florida - Interviewing Psychiatrists",0,Healthcare & Nursing Jobs
199,NHR,2018-09-28,East Coast FL Fast Track/Urgent Care Need,0,Healthcare & Nursing Jobs
200,"MD Staff Pointe, LLC",2018-09-28,Permanent Neurology Opportunity in Florida,0,Healthcare & Nursing Jobs
201,Integrity Healthcare,2018-09-28,Outpatient Pediatrics - Coastal Florida Panhandle,0,Healthcare & Nursing Jobs
202,Continuum Medical Staffing,2018-09-28,Psychiatrist Medical Direcor Jacksonville Florida,0,Healthcare & Nursing Jobs
203,Quest Healthcare Solutions,2018-09-28,FL Hospitalist Coverage Needed,0,Healthcare & Nursing Jobs
204,National Health Partners,2018-09-28,"General Psychiatrist Needed – Orlando, Florida",0,Healthcare & Nursing Jobs
205,Integrity Healthcare,2018-09-28,"Internal Medicine Physician "" Central Florida - $25K sign on bonus - $220k productivity bonus",0,Healthcare & Nursing Jobs
206,"Hayman Daugherty Associates, Inc",2018-09-28,Urgent Care Physician Job Florida,0,Healthcare & Nursing Jobs
207,Enterprise Medical Recruiting,2018-09-28,Interviewing Urologist in central Florida,0,Healthcare & Nursing Jobs
209,Enterprise Medical Recruiting,2018-09-28,Outpatient Pediatric Practice on Beautiful Gulf Coast,0,Healthcare & Nursing Jobs
211,KPS Physician Staffing,2018-09-28,Primary Care Physician Needed in Prime Emerald coast Location,0,Healthcare & Nursing Jobs
213,Enterprise Medical Recruiting,2018-09-28,"FM, IM or Geriatrics needed in Jacksonville, FL",0,Healthcare & Nursing Jobs
214,Enterprise Medical Recruiting,2018-09-28,Central FL Group Adding OB/GYN Physician,0,Healthcare & Nursing Jobs
215,SourceMD,2018-09-28,OBGYN Opportunity- FL,0,Healthcare & Nursing Jobs
216,SourceMD,2018-09-28,Internal Medicine Opportunity-Coastal Florida,0,Healthcare & Nursing Jobs
217,Continuum Medical Staffing,2018-09-28,Gastroenterology in Kissimmee Florida,0,Healthcare & Nursing Jobs
218,SourceMD,2018-09-28,Gastroenterology Opportunity-Tampa area,0,Healthcare & Nursing Jobs
219,SourceMD,2018-09-28,OBGYN Opportunity- Southeast Florida,0,Healthcare & Nursing Jobs
220,SourceMD,2018-09-28,Addiction Psychiatry Opportunity-Southeast FL,0,Healthcare & Nursing Jobs
221,SourceMD,2018-09-28,Hospitalist Opportunities- FL,0,Healthcare & Nursing Jobs
222,SourceMD,2018-09-28,OBGYN Opportunity- Metro Area Florida,0,Healthcare & Nursing Jobs
223,Continuum Medical Staffing,2018-09-28,"Internal Medicine in St Cloud, FL",0,Healthcare & Nursing Jobs
224,SourceMD,2018-09-28,Gastroenterology- near Orlando area,0,Healthcare & Nursing Jobs
225,SourceMD,2018-09-28,Neurology Opportunity- Tampa/ St Pete area,0,Healthcare & Nursing Jobs
226,SourceMD,2018-09-28,Neurology Opportunity- Central Florida,0,Healthcare & Nursing Jobs
227,SourceMD,2018-09-28,Urology- near Tampa/ St Pete area,0,Healthcare & Nursing Jobs
229,National Health Partners,2018-09-28,"Brand New - Internal Medicine Opportunity Boca Raton, Florida",0,Healthcare & Nursing Jobs
230,National Health Partners,2018-09-28,Internal Medicine Opportunity,0,Healthcare & Nursing Jobs
231,National Health Partners,2018-09-28,Urgent Care position- Southern Georgia: 30 minutes from Tallahassee,0,Healthcare & Nursing Jobs
232,Physician Services,2018-09-28,OB/GYN West Palm Beach FLorida,0,Healthcare & Nursing Jobs
234,Enterprise Medical Recruiting,2018-09-28,"Outpatient Only Internist - Tampa, FL Area - No Call - $300K Potential",0,Healthcare & Nursing Jobs
237,"DOCTORS CHOICE PLACEMENT SERVICES, INC.",2018-09-28,"100% Outpatient Pediatrics Opportunity - Small Town near Gainesville & Jacksonville, FL",0,Healthcare & Nursing Jobs
238,Physician Providers Mgmt. Corp.,2018-09-28,Urologist wanted for Florida,0,Healthcare & Nursing Jobs
239,"DOCTORS CHOICE PLACEMENT SERVICES, INC.",2018-09-28,Primary Care Opportunities in Southeast Florida - Great Location,0,Healthcare & Nursing Jobs
243,National Health Partners,2018-09-28,South Florida seeking Primary Care Physician,0,Healthcare & Nursing Jobs
244,"Hayman Daugherty Associates, Inc",2018-09-28,Urology,0,Healthcare & Nursing Jobs
245,NHR,2018-09-28,"Hospitalist Physician needed near Tampa, FL",0,Healthcare & Nursing Jobs
246,"Hayman Daugherty Associates, Inc",2018-09-28,Internal Medicine,0,Healthcare & Nursing Jobs
247,"Hayman Daugherty Associates, Inc",2018-09-28,Northern Florida Hospitalist Locums Physician opening,0,Healthcare & Nursing Jobs
248,"Hayman Daugherty Associates, Inc",2018-09-28,Busy emergency department in a metro area of Florida,0,Healthcare & Nursing Jobs
249,"Hayman Daugherty Associates, Inc",2018-09-28,Orlando area need for a BC/BE emergency physician.,0,Healthcare & Nursing Jobs
250,National Health Partners,2018-09-28,New Ob/Gyn Job – South Florida,0,Healthcare & Nursing Jobs
251,"Necnic Group, LLC",2018-09-28,Hospitalist Opportunity in Florida,0,Healthcare & Nursing Jobs
252,"DOCTORS CHOICE PLACEMENT SERVICES, INC.",2018-09-28,GENERAL AND CHILD PSYCHIATRISTS NEEDED FOR OUTPATIENT PRACTICE - FLORIDA'S EAST COAST,0,Healthcare & Nursing Jobs
253,Physician Providers Mgmt. Corp.,2018-09-28,Many States & Towns / Many Specialties View All Opportunities,0,Healthcare & Nursing Jobs
254,National Health Partners,2018-09-28,"Internal Medicine Hospitalist opportunity in Broward County, Florida",0,Healthcare & Nursing Jobs
255,"Hayman Daugherty Associates, Inc",2018-09-28,Outpatient IM practice in Florida,0,Healthcare & Nursing Jobs
256,"Hayman Daugherty Associates, Inc",2018-09-28,Metro Florida Gastroenterology,0,Healthcare & Nursing Jobs
257,National Health Partners,2018-09-28,"Day Hospitalist Opportunity – 45 minutes from Orlando, Florida",0,Healthcare & Nursing Jobs
258,National Health Partners,2018-09-28,East Coast Florida seeking Primary Care Physicians,0,Healthcare & Nursing Jobs
259,National Health Partners,2018-09-28,"Sunny Florida - Near Pensacola, FL",0,Healthcare & Nursing Jobs
260,Enterprise Medical Recruiting,2018-09-28,"Miami FM, IM, Geriatrics, Spanish Speaking",0,Healthcare & Nursing Jobs
261,National Health Partners,2018-09-28,West Coast Florida seeking a Family or Internal Medicine Physician to work in an Acute Inpatient Psychiatric Unit.,0,Healthcare & Nursing Jobs
262,National Health Partners,2018-09-28,NEUROLOGIST – Southeast Florida,0,Healthcare & Nursing Jobs
263,SourceMD,2018-09-28,IM Opportunity- Coastal FL,0,Healthcare & Nursing Jobs
264,SourceMD,2018-09-28,Hospitalist Need - near Tampa/ St Pete area,0,Healthcare & Nursing Jobs
265,"The Stembridge Agency, LLC",2018-09-28,"Psychiatry Residency Program Director needed in Trinity, FL, near Tampa (SA197308)",0,Healthcare & Nursing Jobs
266,SourceMD,2018-09-28,Gastroenterology Opportunity- Southwest FL,0,Healthcare & Nursing Jobs
270,SourceMD,2018-09-28,Internal Medicine Opportunity- Southwest FL,0,Healthcare & Nursing Jobs
271,SourceMD,2018-09-28,Hospitalist Opportunity- Southwest FL,0,Healthcare & Nursing Jobs
272,National Health Partners,2018-09-28,"Psychiatry Program Director needed for Broward County, Florida",0,Healthcare & Nursing Jobs
274,"Hayman Daugherty Associates, Inc",2018-09-28,Outpatient Addiction Psychiatry Opening,0,Healthcare & Nursing Jobs
275,Enterprise Medical Recruiting,2018-09-28,"Traditional or Outpatient IM needs in Coastal Stuart, FL",0,Healthcare & Nursing Jobs
277,National Health Partners,2018-09-28,OUTPATIENT OPPORTUNITY IN FORT LAUDERDALE,0,Healthcare & Nursing Jobs
278,Enterprise Medical Recruiting,2018-09-28,"FM/IM need in Fort Walton Beach, FL",0,Healthcare & Nursing Jobs
279,National Health Partners,2018-09-28,Florida opportunities.,0,Healthcare & Nursing Jobs
280,Continuum Medical Staffing,2018-09-28,OB/GYN,0,Healthcare & Nursing Jobs
281,Enterprise Medical Recruiting,2018-09-28,"Ft. Myers, FL Area Outpatient Adult Medicine Primary Care Position",0,Healthcare & Nursing Jobs
283,Enterprise Medical Recruiting,2018-09-28,"Internal Medicine Physician opening in Melbourne, Florida",0,Healthcare & Nursing Jobs
284,"Hayman Daugherty Associates, Inc",2018-09-28,Psychiatry Program Director,0,Healthcare & Nursing Jobs
285,National Health Partners,2018-09-28,South Florida seeking Gastroenterologist,0,Healthcare & Nursing Jobs
286,"DOCTORS CHOICE PLACEMENT SERVICES, INC.",2018-09-28,New: Pediatrics Opportunity - East Coast Florida,0,Healthcare & Nursing Jobs
287,Enterprise Medical Recruiting,2018-09-28,Adding internist to this Outpatient only position in northern FL,0,Healthcare & Nursing Jobs
290,National Health Partners,2018-09-28,Seeking Neurologist in Southern Georgia: 30 minutes from Tallahassee,0,Healthcare & Nursing Jobs
291,Enterprise Medical Recruiting,2018-09-28,Central Florida Medical Center seeking another Urologist,0,Healthcare & Nursing Jobs
292,"Hayman Daugherty Associates, Inc",2018-09-28,3 IM Hospitalists Needed in Southwest Florida,0,Healthcare & Nursing Jobs
298,"Hayman Daugherty Associates, Inc",2018-09-28,Locums need in central Florida,0,Healthcare & Nursing Jobs
299,Enterprise Medical Recruiting,2018-09-28,"Tampa Bay, FL Area Outpatient Primary care Positions",0,Healthcare & Nursing Jobs
300,Enterprise Medical Recruiting,2018-09-28,"Tampa, FL Area Adult Medicine Primary Care Positions",0,Healthcare & Nursing Jobs
301,"Hayman Daugherty Associates, Inc",2018-09-28,Locums need in western Florida,0,Healthcare & Nursing Jobs
302,Enterprise Medical Recruiting,2018-09-28,South Central Florida Outpatient Adult Primary Care Position,0,Healthcare & Nursing Jobs
303,Enterprise Medical Recruiting,2018-09-28,"Three Urologists needed for new Urology practice in Tallahassee, FL",0,Healthcare & Nursing Jobs
